Company,Date of Publishing,Author,Headline,Description,Article Body,URL
HDFC,2024-04-28T15:23:00+05:30,Navdeep Singh,Ahead of Market: 10 things that will decide stock action on Monday,"Domestic benchmark equity indices experienced a decline on Friday, primarily due to weakness in the financial sector. However, these losses did not overshadow the weekly gains, which were fueled by a post-results rally in key index constituents and reduced concerns regarding the Middle East.","Domestic benchmark equity indices experienced a decline on Friday, primarily due to weakness in the financial sector. However, these losses did not overshadow the weekly gains, which were fueled by a post-results rally in key index constituents and reduced concerns regarding the Middle East.The NSE Nifty 50 was down 0.67% to 22,420, on the day, while the S&P BSE Sensex shed 0.82% to 73,730. Both the indexes snapped a five-day winning streak. However, for the week, the Nifty 50 and Sensex gained about 1.25% and 1%, respectively.Here's how analysts read the market pulse: The Nifty witnessed selling pressure throughout the day and closed weak for the day down ~120 points. On the daily charts, we can observe that the Nifty has faced selling pressure from the resistance zone of 22560 – 22625. Until this zone is not taken out decisively, we can expect the consolidation to continue. On the downside, crucial support is now placed at 22240 – 22200 where support parameters in the form of the 40-day moving average and the 50% Fibonacci retracement level of the rise from 21777 – 22626 is placed,  said Jatin Gedia of Sharekhan.Rupak De of LKP Securities, said,  Nifty remained under selling pressure throughout the session as the index failed to sustain above the crucial level of 22500. On the daily chart, a dark cloud cover pattern is observed, indicating a potential bearish reversal. Immediate support is situated at 22300, below which the Nifty could extend its losses towards 22000. On the other hand, the level of 22500 might act as a technical resistance for the Nifty. That said, here’s a look at what some key indicators are suggesting for Monday's action:US Market Close HigherUS stocks closed higher on Friday, buoyed by a rally in megacap growth stocks following robust quarterly results from technology heavyweights Alphabet and Microsoft in addition to moderate inflation data.The S&P 500 and the Nasdaq registered their biggest weekly percentage gains since early November 2023. Benchmark S&P 500 snapped three weeks of losses, while the Nasdaq ended four straight weeks of declines.The Dow Jones Industrial Average rose 0.40%, the S&P 500 gained 1.02% and the Nasdaq Composite gained 2.03%.European Shares Notch 1.8% Weekly GainThe pan-European STOXX 600 index closed 1.2% higher, notching up a weekly gain of 1.8%, its biggest since late January.The basket of STOXX 600 banks touched a nine-month high, aided by a 6.1% jump in NatWest after the British bank's first-quarter results.Tech View: Dark cloud cover candlestickNifty ended 150 points lower on Friday to form a dark cloud cover candlestick on the daily chart while the weekly one saw a high wave type candle suggesting consolidation in the near term.The short-term trend of Nifty seems to have reversed down after a reasonable rise from the lows. Immediate support is placed at 22300 and the weakness below this support could trigger more declines ahead. Immediate resistance is at 22625 levels, Nagaraj Shetti of HDFC Securities said.Stocks showing bullish bias:Momentum indicator Moving Average Convergence Divergence (MACD) showed bullish trade on the counters of HUDCO, Westlife Foodworld, Tech Mahindra, DCM Shriram, Lemon Tree Hotels, and Bank of Maharashtra among others.The MACD is known for signaling trend reversals in traded securities or indices. When the MACD crosses above the signal line, it gives a bullish signal, indicating that the price of the security may see an upward movement and vice versa.Stocks signaling weakness aheadThe MACD showed bearish signs on the counters of Borosil Renewables, Tata Consumer, Tamilnad Mercantile, Mankind Pharma, CSB Bank, and Bajaj Finance among others. Bearish crossover on the MACD on these counters indicated that they have just begun their downward journey.Most active stocks in value termsBajaj Finance (Rs 3,948 crore), Kotak Bank (Rs 3,602 crore), Tech Mahindra (Rs 2,663 crore), HDFC Bank (Rs 1,883 crore), ICICI Bank (Rs 1,572 crore), RIL (Rs 1,370 crore), and SBI (Rs 1,204 crore) among others were among the most active stocks on NSE in value terms. Higher activity on a counter in value terms can help identify the counters with highest trading turnovers in the day.Most active stocks in volume termsTata Steel (Shares traded: 6.5 crore), Kotak Bank (Shares traded: 2.2 crore), Tech Mahindra (Shares traded: 2 crore), Power Grid (Shares traded: 1.6 crore), SBI (Shares traded: 1.5 crore), ITC (Shares traded: 1.4 crore), and ICICI Bank (Shares traded: 1.4 crore) among others were among the most traded stocks in the session on NSE.Stocks showing buying interestShares of Hindalco, Eicher Motors, Tata Steel, SBI, and JSW Steel among others witnessed strong buying interest from market participants as they scaled their fresh 52-week highs, signaling bullish sentiment.Stocks seeing selling pressureShares of Sheela Foam hit their 52-week lows, signaling bearish sentiment on the counter.Sentiment meter favours bullsOverall, market breadth favoured bulls as 1,920 stocks ended in the green, while 1,866 names settled in the red.(Disclaimer: Recommendations, suggestions, views and opinions given by the experts are their own. These do not represent the views of Economic Times)",https://economictimes.indiatimes.com/markets/stocks/news//markets/stocks/news/ahead-of-market-10-things-that-will-decide-stock-action-on-monday/articleshow/109664887.cms
HDFC,2024-04-28T12:51:00+05:30,PTI,"Mcap of 6 most valued firms rise Rs 1.30 trillion; SBI, ICICI Bank top gainers","​The combined market valuation of six of the top-10 most valued firms increased Rs 1,30,734.57 crore last week, with State Bank of India and ICICI Bank emerging as the biggest gainers in line with an overall positive trend in equities.","The combined market valuation of six of the top-10 most valued firms increased Rs 1,30,734.57 crore last week, with State Bank of India and ICICI Bank emerging as the biggest gainers in line with an overall positive trend in equities.Last week, the BSE benchmark advanced 641.83 points or 0.87 per cent.The valuation of the State Bank of India rallied Rs 45,158.54 crore to Rs 7,15,218.40 crore.ICICI Bank's market valuation rose Rs 28,726.33 crore to Rs 7,77,750.22 crore.Bharti Airtel added Rs 20,747.99 crore to Rs 7,51,406.35 crore, and that of ITC jumped Rs 18,914.35 crore to Rs 5,49,265.32 crore.The market capitalisation (mcap) of Life Insurance Corporation of India (LIC) advanced by Rs 9,487.5 crore to Rs 6,24,941.40 crore, and that of Infosys went up by Rs 7,699.86 crore to Rs 5,93,636.31 crore.However, the mcap of Reliance Industries declined by Rs 26,115.56 crore to Rs 19,64,079.96 crore.The valuation of HDFC Bank dipped by Rs 16,371.34 crore to Rs 11,46,943.59 crore.The mcap of Tata Consultancy Services went lower by Rs 5,282.41 crore to Rs 13,79,522.50 crore, and that of Hindustan Unilever Limited diminished by Rs 2,525.81 crore to Rs 5,21,961.70 crore.Reliance Industries remained the most valued firm from the top-10 pack, followed by Tata Consultancy Services, HDFC Bank, ICICI Bank, Bharti Airtel, State Bank of India, LIC, Infosys, ITC and Hindustan Unilever.",https://economictimes.indiatimes.com/markets/stocks/news//markets/stocks/news/mcap-of-6-most-valued-firms-rise-rs-1-30-trillion-sbi-icici-bank-top-gainers/articleshow/109662539.cms
HDFC,2024-04-28T10:19:00+05:30,ET CONTRIBUTORS,Why Nifty Bank has underperformed Nifty50 in the past one year,​Rallies in the markets may not present a clear picture of certain key developments. This is the very nature of the markets. A little bit of digging helps reveal stories which may not be apparent in the broad sentiment which engulfs the markets.,"Rallies in the markets may not present a clear picture of certain key developments. This is the very nature of the markets. A little bit of digging helps reveal stories which may not be apparent in the broad sentiment which engulfs the markets. Take for instance, the banking index. In the past one year ended April 22, 2024, the Nifty Bank index has given only 12.41% returns compared to 25.89% returns by the Nifty 50 index. Beneath this underperformance lies a story. Let us explore it in detail:Investors preferred public sector banks (BPSUs) to private sector banks. BPSUs largely finance institutional and corporate borrowers and private sector banks are known for catering retail credit needs. Despite strong credit offtake, stocks of private sector banks did not do well. There is a reason. Private sector banks were richly valued compared to BPSUs. In a high interest rate regime, value conscious investors preferred to stick to BPSU. The PSU rally also improved the sentiment around PSU bank stocks. However, these stocks have a relatively low weight (around 15%) in the Nifty Bank index. Hence the positive impact on Nifty Bank Index was not as much.The largest stock in the Nifty Bank Index – HDFC Bank--with 29% weight remained under pressure through the year due to a variety of reasons. Investors have concerns about the challenges related to compliance and funding post the merger of HDFC Bank with its parent: Housing Development Finance Limited (HDFC). In the past one year, HDFC Bank's shares have lost 10.3%.Another important reason for weak performance of banks' stocks is the regulatory actions by the Reserve Bank of India. RBI slapped fines to many lenders due to slippages in the areas of know-your-client, risk categorisation, and provisioning among others. Though, fines looked small in the context of the quantum of profits of banks. RBI also made a few banks stop onboarding new clients and selling new credit cards. These actions impacted stock prices of banks. Investors also factored in lower earnings from other banks offering similar products, anticipating similar regulatory actions. These facts turned investors cautious.In contrast to this, stocks from auto, power and energy sectors did well and lifted the returns offered by the Nifty 50 index. Among constituents of the Nifty 50 Index, Bajaj Auto, National Thermal Power Corporation (NTPC) and Tata Motors gained more than 100% in the past one year. All in all, this was not a year for banking stocks. Even Q4 numbers announced by HDFC Bank were below expectations. However, things are expected to change for the better going ahead.Going forward, as net interest margins (NIM) of banks stabilise due to increasing deposits and credit offtake, profitability of banks should improve. If inflation comes down and interest rates are cut towards the end of the current year, then it should improve banks' earnings. This can trigger upward movement in the Nifty Bank index.In the near term, geo-political tensions in the Middle East and the Lok Sabha elections are the two events which could trigger volatility in the broad markets. The Nifty Bank Index should get a strong support at 46,950 and then at 45,500. A close above previous high of 49,057, should take the Nifty Bank index to a new high of 51,300 if possible.On the Nifty 50 index, 21800 should act as a strong support. If the Nifty 50 index does not break it and manages to stay above the psychologically important level of 22,000, then the Nifty 50 index should see an upside of 22500-22800. A new high around 23,150 is possible. However, a break below 21,800 will take Nifty 50 to 21,250 and 20,800 levels.(The author is the founder & CEO of SAS Online – a deep discount stock broking platform. Views are own)",https://economictimes.indiatimes.com/markets/stocks/news//markets/stocks/news/why-nifty-bank-has-underperformed-nifty50-in-the-past-one-year/articleshow/109660443.cms
HDFC,2024-04-27T10:49:00+05:30,Shivendra Kumar,"Block deals worth over Rs 12,045 crore this week. Kotak Bank, Vodafone Idea among stocks with major action"," In the large cap segment, 15 companies witnessed significant block deals on the screen which were worth Rs 6,046 crore led by Kotak Mahindra Bank with 29 block counts, totalling to Rs 1,310 crore.","Amid high volatility, the headline index Nifty ended with 1.3% gains on the weak-on-weak basis. It was laden with top action where over three dozen companies from large, mid and smallcap segments witnessed prominent block deals worth Rs 12,045 crore on screen which included both buying and selling action. In the large cap segment, 15 companies witnessed significant block deals on the screen which were worth Rs 6,046 crore led by Kotak Mahindra Bank with 29 block counts, totalling to Rs 1,310 crore. The next in line were Adani Ports and Special Economic Zone (Rs 1,114 crore), Bank of Baroda (Rs 853 crore), NTPC (448 crore), Canara Bank (Rs 422 crore), HDFC Bank (L&T, Rs 298 crore), Hindustan Unilever (HUL, Rs 239 crore) and Mahindra & Mahindra (M&M, Rs 200 crore). Others were, namely Reliance Industries (RIL), Tech Mahindra, United Spirits, Cipla, Bajaj Finance, Axis Bank and Havells India with block deals between Rs 190 crore and Rs 110 crore.The data has been compiled by brokerage firm Nuvama and pertains to deals done this week between 8:45 am and 3:30 pm. 109640599Source: NuvamaIn the midcap segment, a dozen companies witnessed prominent block deals on the screen which were worth Rs 4,045 crore. The leader in the pack was Vodafone Idea with deal size standing at Rs 1,512 crore followed by Delhivery (Rs 909 crore), PB FIntech (Policybazaar, Rs 268 crore) and Bandhan Bank (Rs 219 crore). The others were Macrotech Developers, Prestige Estates, Union Bank, Power Finance Corporation, Sundaram Fasteners, Colgate Palmolive, Polycab India and Steel Authority of India (SAIL) which saw deals between Rs 218 crore and 99 crore. 109640611Source: NuvamaAs for the smallcap stocks, block deals worth Rs 1,954 crore were struck in 12 companies. The number one spot went to 360 One (Rs 550 crore) followed by Gujarat State Petronet (Rs 314 crore) and SPARC (Rs 173 crore). The others were Sterling & Wilson, Manappuram Finance, Cyient, Tejas Networks, Kalpataru Projects, Ujjivan Financial Services, Voltamp Transformers, CIE Automotive and Century Plyboard which saw deals between Rs 149 crore and 70 crore. 109640624Source: NuvamaNuvama also reported prominent bulk, block and insider deals in 8 stocks with details on buyers and sellers. Among them were Delhivery with four buyers and one seller with HSBC, FIdelity and Small Cap World Fund among buyers while Canada Pension Plan as a seller. In Restaurants Brand Asia, Fidelity sold shares worth Rs 26 crore and in Cyient DLM, BNP Paribas sold 7,03,000 shares worth Rs 52 crore.The other stocks which saw prominent bulk, block and insider deals include Harsha Engineers International, India Pesticides and Yuken India.(Disclaimer: Recommendations, suggestions, views and opinions given by the experts are their own. These do not represent the views of Economic Times)",https://economictimes.indiatimes.com/markets/stocks/news//markets/stocks/news/block-deals-worth-over-rs-12045-crore-this-week-kotak-bank-vodafone-idea-among-stocks-with-major-action/articleshow/109640629.cms
HDFC,2024-04-26T14:41:00+05:30,PTI,"RBI action on Kotak Mahindra Bank may restrain credit growth, profitability: S&P","S&P Global Ratings warned that RBI's recent regulatory action on Kotak Mahindra Bank could limit the bank's credit growth and profitability. The RBI prohibited Kotak Mahindra Bank from issuing new credit cards and onboarding customers online, impacting a key growth segment. S&P noted the bank may need to rely more on physical branch expansion, increasing operating costs. However, the impact on the bank's credit rating is expected to be minimal, as credit cards constitute a small portion of its total loans. S&P anticipates that Kotak Mahindra Bank may need around a year to address the RBI's concerns related to system stability and disaster recovery. ","S&P Global Ratings on Friday said RBI's regulatory action on Kotak Mahindra Bank could restrain the lender's credit growth and profitability. The RBI on Wednesday barred Kotak Mahindra Bank from issuing fresh credit cards and onboarding new customers online.  Credit cards are a higher-yielding target growth segment for Kotak Mahindra Bank. This portfolio grew at 52 per cent year-on-year as of December 31, 2023, compared with total loan growth of 19 per cent, the US-based rating agency said.   Action by the Reserve Bank of India (RBI) this week could push the bank to rely more on physical branch network expansion to supplement growth thus entailing higher operating costs,  S&P said, adding that it could be a setback for credit growth and profitability.  This action will not, however, materially affect our ratings on Kotak Mahindra Bank (BBB-/Stable/A-3). This is because credit cards make up a small 4 per cent of total loans as of the end of December 2023. The bank will still be able to cross-sell its other products to existing customers.   We anticipate Kotak Mahindra Bank could potentially take a year to fully address the RBI's key concerns for the bank which encompasses systems stability, patch management, and disaster recovery,  S&P said.  RBI's actions on Kotak Mahindra Bank follow similar actions in recent years on other financial institutions in India.  S&P said in a similar case in 2020, when HDFC Bank was temporarily barred from sourcing new credit card customers, it took the bank more than a year to meet the RBI's requirements and have restrictions lifted.  In the past 18 months, Kotak Mahindra Bank has made significant progress on technological enhancements, including the hiring of senior level executives in the chief technology officer and chief experience officer positions, S&P said.  Nevertheless, it will take time for the bank to implement changes and conduct a comprehensive external audit to address the RBI's concerns.  RBI's actions on Kotak Mahindra Bank follow several outages of the bank's core banking systems as well as online and digital banking channels, and deficiencies identified through the RBI's IT examinations in 2022 and 2023.  This shows the regulator's commitment to strengthening the financial sector and its diminishing tolerance for operational deficiencies.  Systems stability and robust disaster recovery planning have become increasingly important with the rapid scale up in digital transactions in India.   Regulators across many jurisdictions are adopting a similar playbook. The Monetary Authority of Singapore recently imposed a six-month ban on DBS Bank Ltd from making new acquisitions and closing branches or ATMs following several service disruptions in 2023,  S&P noted.",https://economictimes.indiatimes.com/markets/stocks/news//industry/banking/finance/banking/rbi-action-on-kotak-mahindra-bank-may-restrain-credit-growth-profitability-sp/articleshow/109621499.cms
