Date,Open,High,Low,Close,Adj Close,Volume,Company,Date of Publishing,Author,Headline,Description,Article Body,URL,score
24-02-2020,1343.840454,1350.46936,1316.227661,1321.165039,1302.374268,10685107.0,RI,2020-02-24T11:55:00+05:30,Bloomberg,Mukesh Ambani’s plans to make Reliance Industries debt-free hit multiple snags,"India Business News: Six months after Mukesh Ambani laid out a road map to make Reliance Industries Ltd (RIL) free of net debt by early 2021, his plan has hit a few bumps ","NEW DELHI: Six months after Mukesh Ambani laid out a road map to make Reliance Industries Ltd (RIL) free of net debt by early 2021, his plan has hit a few bumps thanks to the government.Prime Minister Narendra Modi’s administration has petitioned a court to halt a proposed stake sale by RIL to Saudi Arabian Oil Co, threatening a key source of funds needed to pare liabilities. In addition, the conglomerate, which is into oil refining, telecommunications and retail, is also facing unfriendly tax proposals that could hit its businesses.Shares of the company have slid almost 8% since reaching a record high in mid-December. A spokesman for RIL declined to comment. Here are four challenges the company is facing:Aramco deal delay:Mukesh Ambani told shareholders in August that RIL would sell 20% of its oil and petrochemicals unit to Aramco in a deal valuing the business at $75 billion. The sale is crucial to reduce the group’s net debt, which was about $22 billion at the end of March 2019.But in December, the government requested a court to stop the proposed sale to help ensure the Mumbai-based company has enough assets to pay claims in an arbitration case related to profit sharing and royalty payments between Reliance Industries and its partners. RIL says the government’s plea isn’t tenable legally and should be dismissed.RIL expected to complete the Aramco transaction by March 2020 subject to due diligence and regulatory approvals, but said in January that although the talks with Aramco were making “good progress,” a definitive pact is still a few months away. The talks have gathered pace in recent weeks, according to people familiar with the matter.Income tax (I-T) investigation:The tax department has widened a probe to find whether some Ambani family members have evaded tax, according to people familiar with the matter. The conglomerate has denied that they have dodged taxes.The investigation is based on information the government received from French authorities in 2011 about 700 Indians who had accounts at HSBC Holdings Plc’s Swiss branches, the people said, asking not to be named citing rules.While tax probes are common in India and are, in many cases, driven by politics, the country’s richest family becoming the subject of an investigation is unprecedented and has surprised many. Ambani is Asia’s richest person, with a net worth of about $58 billion, according to the Bloomberg Billionaires Index.A spokesperson for the tax department didn’t respond to an email seeking comment.Protective tariff scrapped:Reliance Industries, the country’s largest producer of a chemical used to make polyester yarn, will face more competition in the segment after a proposed cut in import duties for purified terephthalic acid. In her February 1 budget speech, finance minister Nirmala Sitharaman said the government is getting rid of the duty to help ensure the easy availability of the commodity at competitive prices.Tax on investment trusts:The government has also proposed a change to dividend distribution tax, a step that could slow efforts of companies, including Reliance Industries, to raise funds through selling units in investment trusts.The conglomerate has been trying to raise funds and pare debt by selling a stake in trusts that hold its telecom towers and optical-fiber network.The change in rules will curtail returns for investors in the trusts by forcing them to add dividends to their total income and paying tax. The impact of higher tax for unit holders may make equity raising challenging, according to Shubham Jain, a senior vice president at ICRA Ltd, the local unit of Moody’s Investors Service.",https://timesofindia.indiatimes.com/business/india-business/mukesh-ambanis-plans-to-make-reliance-industries-debt-free-hit-multiple-snags/articleshow/74278747.cms,1
25-02-2020,1327.0625,1327.0625,1289.209106,1295.060913,1276.641479,13872531.0,,,,,,,,-1
26-02-2020,1289.209106,1291.357788,1268.499512,1272.751099,1254.648926,14681374.0,,,,,,,,-1
27-02-2020,1269.09375,1274.396973,1251.721436,1267.493774,1249.466431,12527496.0,,,,,,,,-1
28-02-2020,1238.829346,1240.749512,1211.490845,1214.828125,1197.549805,19657884.0,,,,,,,,-1
02-03-2020,1239.012207,1251.721436,1189.638306,1203.399048,1186.283325,14750247.0,,,,,,,,-1
03-03-2020,1215.788208,1237.915039,1208.747803,1227.811646,1210.348633,13699399.0,,,,,,,,-1
04-03-2020,1236.177856,1237.823608,1195.855713,1224.931519,1207.509644,11052630.0,,,,,,,,-1
05-03-2020,1236.360718,1241.618164,1194.11853,1198.827393,1181.776733,15255195.0,,,,,,,,-1
06-03-2020,1161.202515,1177.797729,1134.77832,1162.116821,1145.588135,16867019.0,,,,,,,,-1
09-03-2020,1133.818237,1134.68689,1001.194336,1018.703796,1004.214905,44093509.0,,,,,,,,-1
11-03-2020,1013.080627,1077.495361,1013.080627,1054.728516,1039.727295,29789288.0,,,,,,,,-1
12-03-2020,992.051025,1006.680298,958.860718,971.935669,958.112,27985242.0,,,,,,,,-1
13-03-2020,912.504028,1042.339355,861.667175,1010.611938,996.238159,36648701.0,,,,,,,,-1
16-03-2020,969.695557,987.205017,918.904358,928.687744,915.479187,19241129.0,,,,,,,,-1
17-03-2020,957.534912,969.192688,917.258606,921.6474,908.539001,22722989.0,,,,,,,,-1
18-03-2020,937.465332,947.157288,878.673767,885.53125,872.936523,22365207.0,,,,,,,,-1
19-03-2020,841.277527,884.159729,815.767639,839.08313,827.149048,30702005.0,,,,,,,,-1
20-03-2020,859.015564,946.24292,850.329407,930.744995,917.507141,31680237.0,,,,,,,,-1
23-03-2020,837.711609,868.616089,800.635437,808.315857,796.819336,20335474.0,RI,2020-03-23T17:59:00+05:30,PTI,"Reliance sets up India's 1st dedicated Covid-19 hospital, to pay contract workers wages","India Business News: Reliance Industries on Monday said it will pay contract and temporary workers wages even in case of no work due to coronavirus outbreak, set up India'","NEW DELHI: Reliance Industries on Monday said it will pay contract and temporary workers wages even in case of no work due to coronavirus outbreak, set up India's first dedicated Covid-19 hospital in Mumbai, ramp up face-mask production capacity and provide free meals and fuel to deal with the crisis.In a raft of measures to deal with the pandemic, India's largest company in a statement said it has ""initiated a multi-pronged prevention, mitigation, and ongoing support strategy"" which can be ramped up further to scale as required.Detailing the measures, the oil-to-telecom conglomerate said it has set up ""India's first dedicated Covid-19 hospital"".""In a short time-span of just two weeks, Sir H N Reliance Foundation Hospital in collaboration with the Brihanmumbai Municipal Corporation (BMC), has set up a dedicated 100-bedded centre at Seven Hills Hospital, Mumbai for patients who test positive for Covid-19.""This first-of-its-kind-in-India centre is fully funded by Reliance Foundation and includes a negative pressure room that helps in preventing cross-contamination and helps control infection. All beds are equipped with the required infrastructure, biomedical equipment such as ventilators, pacemakers, dialysis machine and patient monitoring devices,"" it said.More on Covid-19Coronavirus pandemic: Complete coverageCoronavirus: What are the symptoms52 testing sites for coronavirus in IndiaHelpline numbers for states and UTsDo fever and cough mean you need Covid-19 test?How to stay safeHow to quarantine yourself at homeAlso, Sir H N Reliance Foundation Hospital in Mumbai has offered to set up special medical facilities to quarantine travellers from notified countries and suspected cases identified through contact tracing. ""This will quickly augment additional facilities for isolation and treatment of infected patients.""Reliance has built a fully-equipped isolation facility in Lodhivali, Maharashtra and handed it over to the district authorities even as Reliance Life Sciences is importing additional test kits and consumables for effective testing.""Our doctors and researchers are also working overtime to find a cure for this deadly virus,"" the statement said.With 415 cases of the coronavirus and seven deaths, several cities and states have declared lockdown to check the spread of the virus. India Inc has joined the government effort to deal with the crisis.Reliance said it is raising its production capacities to produce 100,000 face-masks per day and a large number of personal protective equipment (PPEs), such as suits and garments, for the health-workers to equip them further to fight the coronavirus challenge.""Reliance will provide free fuel for all emergency service vehicles used to transport Covid-19 patients and quarantined people,"" it said.In addition, Reliance Foundation will provide free meals to people across various cities in partnership with NGOs to those whose livelihood has been impacted by the current crisis.The firm said it ""will continue to pay contract and temporary workers, even if work has halted due to this crisis.""For its employees earning below Rs 30,000 per month, salaries will be paid twice a month to protect their cashflow, the statement said. ""Reliance has moved most of its employees to its Work-From-Home platform except for those who are manning critical roles in maintaining the Jio (telecom) network for nearly 40 crore customers and for providing an uninterrupted supply of fuel, grocery and other essential items of daily consumption.""On its retail business, the company said: ""all the 736 grocery stores of Reliance Retail across the country will ensure sufficient supply of essentials, including staples, fruits and vegetables, bread, breakfast cereals and other items of daily use so that citizens need not stock up.""""Grocery stores to open longer - from 7 am to 11 pm - wherever possible,"" it said adding the firm is activating ordering from home and delivery for senior citizens as well as activating order and pick-up from storefront so that the consumers and store staff are not exposed.Reliance Retail will ply vehicles with essential items in certain areas for sale to customers at their doorsteps during the complete lockdown, the statement said adding the firm's petrol pumps will remain open to customers to ensure there is no shortage of fuel.All store staff are adequately trained and protected with masks and follow a strict hygiene regime, it added.To enable India remains connected during the lockdown, Reliance's telecom arm, Jio is combining its digital capabilities with Microsoft Teams, the unified communication and collaboration hub for teamwork in Office 365, to enable individuals, students, educational and healthcare institutions to continue their professional lives while still practising social distancing.Its broadband service, JioFiber will provide 10 Mbps of connectivity, wherever geographically feasible, without any service charges, for the lockdown period. ""Jio will also provide home gateway routers with a minimum refundable deposit.""""Jio will provide double-data across its 4G data add-on vouchers. It will also bundle non-Jio voice calling minutes in these vouchers at no additional cost, to meet the increased need of these services,"" the statement added. ",https://timesofindia.indiatimes.com/business/india-business/reliance-sets-up-indias-1st-dedicated-covid-19-hospital-to-pay-contract-workers-wages/articleshow/74776537.cms,2
23-03-2020,837.711609,868.616089,800.635437,808.315857,796.819336,20335474.0,RI,2020-03-23T16:55:00+05:30,PTI,"Reliance to raise face mask production capacity, pay contract employees wages even if no work","India Business News: To deal with the coronavirus pandemic, Reliance Industries on Monday announced a raft of measures, including ramping up production capacity to 1 lakh ","NEW DELHI: To deal with the coronavirus pandemic, Reliance Industries on Monday announced a raft of measures, including ramping up production capacity to 1 lakh face masks per day, free fuel to emergency vehicles carrying Covid-19 patients and free meals in various cities to support the livelihood of those impacted by the outbreak.In a statement, the company said a hospital run by its CSR (corporate social responsibility) arm has readied India's first 100-bedded facility at one of its hospitals in Mumbai for patients who test positive for Covid-19.Also, the company said it will continue to pay contract and temporary workers, even if work has halted due to this crisis.Reliance will provide free fuel for all emergency service vehicles used to transport Covid-19 patients while Reliance Foundation will provide free meals across various cities to those whose livelihood has been hit by the outbreak.",https://timesofindia.indiatimes.com/business/india-business/reliance-to-raise-face-mask-production-capacity-pay-contract-employees-wages-even-if-no-work/articleshow/74775344.cms,0
24-03-2020,850.329407,886.90271,819.059265,862.581482,850.31311,22867443.0,,,,,,,,-1
25-03-2020,881.233887,1052.89978,880.731018,989.53656,975.462585,36565149.0,RI,2020-03-25T12:52:00+05:30,PTI,RIL overtakes TCS to become most valued firm again as shares jump 15%,"India Business News: Shares of Reliance Industries Limited on Wednesday zoomed nearly 15 per cent, reclaiming the tag of the most valued domestic firm by market valuation ","NEW DELHI: Shares of Reliance Industries Limited on Wednesday zoomed nearly 15 per cent, reclaiming the tag of the most valued domestic firm by market valuation surpassing TCS.RIL's scrip jumped 14.65 per cent to close at Rs 1,081.25 on the BSE. During the day, it advanced 22.25 per cent to Rs 1,152.On the NSE, it rose sharply by 13.84 per cent to close at Rs 1,074.The sharp rally in the shares helped the company's market valuation zoom Rs 87,576.98 crore to Rs 6,85,433.30 crore on the BSE.The heavyweight stock was the top gainer on both the key indices. Meanwhile, there were media reports that Facebook Inc was in talks to buy stake in the company's telecom unit, Jio.In traded volume terms, 1,176.09 lakh shares of the company were traded on the BSE and about 3.34 crore shares on the NSE during the day.RIL went ahead Tata Consultancy Services (TCS) in market cap ranking during the morning trade following a sharp rally in its share price.The market valuation of TCS was at Rs 6,57,492.85 crore at close of trade on the BSE. Tata Consultancy Services had on March 18 went past Reliance Industries Limited to become the most valued Indian firm by market valuation.The BSE benchmark index closed 1,861.75 points higher at 28,535.78. RIL was the biggest contributor in the market rally.The m-cap figure of companies changes daily with the movement in their stock prices.",https://timesofindia.indiatimes.com/business/india-business/ril-overtakes-tcs-to-become-most-valued-firm-again-as-shares-jump-10/articleshow/74806690.cms,0
26-03-2020,1001.925781,1021.218201,953.054688,974.861511,960.996216,22872244.0,,,,,,,,-1
27-03-2020,1001.194336,1012.440613,956.57489,974.312927,960.455444,20828970.0,,,,,,,,-1
30-03-2020,951.454651,982.724792,932.619385,942.174133,928.773743,15114933.0,RI,2020-03-30T20:30:00+05:30,PTI,Reliance Industries announces Rs 500 crore contribution to PM CARES Fund,"India Business News: Reliance Industries' chief Mukesh Ambani on Monday committed Rs 500 crore to the Prime Minister's COVID-19 fund, topping up over the multi-crore initi","NEW DELHI: Reliance Industries' chief Mukesh Ambani on Monday committed a further Rs 500 crore to the Prime Minister's COVID-19 fund, topping up over the multi-crore initiative of India's first coronavirus hospital, meals to the needy, and fuel to emergency vehicles.In addition to the financial contribution to the PM's Fund, Reliance Industries has also provided contribution of Rs 5 crore each to the governments of Maharashtra and Gujarat to support their fight against COVID-19, according to a company statement.""Reliance Industries Ltd (RIL) today announced a donation of Rs 500 crore to PM CARES Fund in response to the call by the Prime Minister to support the nation's fight against the coronavirus onslaught,"" RIL statement said.Coronavirus lockdown: Latest updatesRIL continues its round-the-clock, multi-pronged, on-the-ground effort to do its bit to ensure the nation remains prepared, fed, supplied, safe, connected and motivated to fight and win against the unprecedented challenges brought upon by the coronavirus pandemic, the statement added.The company said it has already deployed the strengths of the Reliance family on this action plan against coronavirus, and that RIL and its team have stepped up across cities and villages and pressed additional capabilities into the service of the nation.""We are confident that India will conquer the coronavirus crisis sooner rather than later. The entire Reliance Industries team is with the nation in this hour of crisis and will do everything to win this battle against Covid-19,"" Mukesh Ambani, chairman and managing director of RIL said.Nita Ambani, founder chairperson of Reliance Foundation, said, “As the nation comes together to fight the Covid-19 pandemic, all of us at Reliance Foundation stand in solidarity with our countrymen and women, especially those on the frontlines to whom we pledge our full support. Our doctors and staff have helped set up India's first Covid-19 Hospital and are committed to supporting the government in exhaustive screening, testing, prevention, and treatment of Covid-19.”More on Covid-19Coronavirus pandemic: Complete Coverage21-day lockdown: What will stay open and what won'tHow to quarantine yourself at homeTrust the newspaper for your daily verified news The need of the hour is to support marginalised and daily wage communities, she said adding that ""through our meal distribution programme, we aim to feed lakhs of people daily across the country.” 74776537 Earlier this month, RIL had announced a host of measures as an aid in the ongoing coronavirus outbreak including continued pay to temporary workers, setting up a dedicated covid-19 hospital and ramping up face-mask production.Corporate India has been rushing in to help the government and citizens fight the covid-19 pandemic in India. Tata Trusts & Tata group together have pledged Rs 1,500 crore - by far the highest by any corporate.Paytm will contribute Rs 500 crore to PM's Fund, L&T and NMDC have contributed Rs 150 crore each. Firms or philanthropy arms of billionaires Gautam Adani, Anil Agarwal and Sajjan Jindal have each contributed Rs 100 crore and so has an equal amount committed by HUL, PhonePe, Torrent Group and Bajaj Group.ITC has pledged Rs 50 crore. Torrent Group will contribute Rs 50 crore towards PM-CARES Fund and an equivalent amount for other initiatives such as providing medicines to government hospitals.Private sector lender Kotak Mahindra Bank and its managing director Uday Kotak announced a Rs 60-crore donation. Asian Paints has chipped in Rs 35 crore, TVS Motors Rs 25 crore and LNJ Bhilwara Group Rs 5.51 crore. IIFL has committed Rs 5 crore. ",https://timesofindia.indiatimes.com/business/india-business/reliance-industries-announces-rs-500-crore-contribution-to-pm-cares-fund/articleshow/74898419.cms,0
31-03-2020,981.947632,1033.013062,958.220703,1018.338074,1003.854431,22146405.0,,,,,,,,-1
01-04-2020,1026.109863,1028.258545,955.660583,987.890808,973.84021,20798729.0,,,,,,,,-1
03-04-2020,1037.264771,1037.264771,965.809631,985.147766,971.136169,20683903.0,,,,,,,,-1
07-04-2020,1007.686096,1109.999878,1005.765991,1102.776733,1087.092041,27186812.0,,,,,,,,-1
08-04-2020,1078.912598,1123.714966,1060.625977,1090.021729,1074.518555,24940165.0,,,,,,,,-1
09-04-2020,1109.999878,1127.189331,1090.79895,1115.440186,1099.575439,16516428.0,,,,,,,,-1
13-04-2020,1100.810913,1110.914307,1078.912598,1087.278809,1071.814575,11836892.0,,,,,,,,-1
15-04-2020,1094.501953,1130.115234,1045.082275,1051.345459,1036.392212,17660921.0,,,,,,,,-1
16-04-2020,1051.345459,1085.724365,1046.911011,1067.986328,1052.796509,18727853.0,,,,,,,,-1
17-04-2020,1111.828613,1124.629272,1090.478882,1119.143188,1103.22583,16634667.0,,,,,,,,-1
20-04-2020,1120.971924,1149.316162,1099.027954,1137.24707,1121.072144,18015466.0,,,,,,,,-1
21-04-2020,1106.342529,1144.744507,1064.283325,1131.349609,1115.258545,30685814.0,,,,,,,,-1
22-04-2020,1206.919189,1266.259399,1188.632568,1246.784058,1229.05127,71341683.0,RI,2020-04-22T09:13:00+05:30,TIMESOFINDIA.COM,"Facebook invests Rs 43,574 crore in Jio: What it may mean for you",The partnership may be eventually lead to the formation of a multipurpose app for online shopping. The companies will work closely to ensure that cons,"Reliance Industries Limited has announced that social media giant Facebook has invested Rs 43,574 crore into Jio Platforms. So, what can Facebook and Jio users expect from this deal? The partnership may eventually lead to the formation of a multipurpose app for online shopping. ""The companies will work together to ensure that consumers are able to access nearest kiranas who can provide products and services to their homes by transacting with JioMart using WhatsApp,"" said Jio in a statement. READ ALSO: Level the field: News producers can’t keep incurring the costs while digital platforms drain away profits""Concurrent with the investment, Jio Platforms, Reliance Retail Limited (“Reliance Retail”) and WhatsApp have also entered into a commercial partnership agreement to further accelerate Reliance Retail’s New Commerce business on the JioMart platform using WhatsApp and to support small businesses on WhatsApp,"" it added. Both Jio and Facebook's WhatsApp will work together to enable kirana shops to deliver products with JioMart using WhatsApp. Facebook founder and CEO Mark Zuckerberg said, “India has more than 60 million small businesses and millions of people rely on them for jobs. With communities around the world in lockdown, many of these entrepreneurs need digital tools they can rely on to find and communicate with customers and grow their businesses. This is something we can help with -- and that's why we're partnering with Jio to help people and businesses in India create new opportunities.”",https://timesofindia.indiatimes.com/gadgets-news/facebook-invests-rs-43574-crore-in-reliance-jio/articleshow/75285071.cms,0
22-04-2020,1206.919189,1266.259399,1188.632568,1246.784058,1229.05127,71341683.0,RI,2020-04-22T12:50:00+05:30,IANS,RIL stocks zoom as FB to invest in Jio Platforms,"India Business News: MUMBAI: Stock prices of Reliance Industries zoomed on Wednesday morning after the company announced that Facebook will invest Rs 43,574 cr in Jio Plat.","MUMBAI: Stock prices of Reliance Industries zoomed on Wednesday morning after the company announced that Facebook will invest Rs 43,574 cr in Jio Platforms for a 9.99 per cent Stake.Jio Platforms is a wholly-owned subsidiary of Reliance Industries.Accordingly, the company's stocks at the BSE gained Rs 83.85 or 6.78 per cent to Rs 1.319.90 per share from its previous close.In the intra-day trade period till now, the stock touched a high of Rs 1,339.20 and a low of Rs 1,300 per share.On early Wednesday morning, the company announced that social media giant Facebook has entered into binding agreements to invest Rs 43,574 crore into Jio Platforms for a 9.99 per cent stake.""This investment by Facebook values Jio Platforms at a 4.62 lakh crore pre-money enterprise value ($65.95 billion, assuming a conversion rate of Rs 70 to a US Dollar),"" RIL said in a statement.""Facebook's investment will translate into a 9.99 per cent equity stake in Jio Platforms on a fully diluted basis,"" it said.Furthermore, the statement said the partnership assumes special significance for India in the wake of the severe disruptions caused by the coronavirus pandemic in the Indian and the global economy.""In the post-COVID era, comprehensive digitalisation will be an absolute necessity for revitalisation of the Indian economy,"" the statement said.""It is our common belief and commitment that no Indian should be deprived of the tremendous new opportunities, including for new employment and new businesses, in the process of India's 360-degree digital transformation.""Concurrently to the investment, Jio Platforms, Reliance Retail and WhatsApp have also entered into a commercial partnership agreement to further accelerate Reliance Retail's New Commerce business on the JioMart platform using WhatsApp and to support small businesses on WhatsApp.",https://timesofindia.indiatimes.com/business/india-business/ril-stocks-zoom-as-fb-to-invest-in-jio-platforms/articleshow/75288657.cms,0
22-04-2020,1206.919189,1266.259399,1188.632568,1246.784058,1229.05127,71341683.0,RI,2020-04-22T12:05:00+05:30,PTI,"Jio-Facebook deal looks at local level e-commerce; to cover education, health gradually: Mukesh Ambani",India Business News: Reliance Jio and Facebook will look to use WhatsApp for delivering goods from local neighborhood Kirana stores to consumers before expanding collabora,"NEW DELHI: Reliance Jio and Facebook will look to use WhatsApp for delivering goods from local neighborhood Kirana stores to consumers before expanding collaboration in education and healthcare sector, billionaire Mukesh Ambani said soon after announcing the mega Rs 43,574 crore deal.""All of us at Reliance and Jio are delighted to welcome Facebook Inc,"" he said in a short video message posted on the group's social media handles.Shri Mukesh D. Ambani, Chairman, Reliance Industries Limited welcomes Mark Zuckerberg, founder @Facebook Inc as a l… https://t.co/4TqhN3FT6m— Reliance Jio (@reliancejio) 1587527972000Earlier in the day, Facebook announced an investment of $5.7 billion (Rs 43,574 crore) to buy a 9.99 per cent stake in the firm that houses Ambani's telecom arm Jio as the social media giant looks to expand presence in its largest market in terms of subscriber base.""The combined power of Jio's world-class digital connectivity platform and Facebook's intimate relationship with the Indian people will offer innovative new solutions to each one of you,"" Ambani said.""In the very near future, JioMart -- Jio's digital new commerce platform, and WhatsApp will empower nearly 3 crore small Indian Kirana shops to digitally transact with every customer in their neighbourhood.""This means all of you can order and get faster delivery of day-to-day items, from nearby local shops. At the same time, small kiranas can grow their businesses and create new employment opportunities using digital technologies,"" Ambani said. 75283747While the Facebook deal is part of value unlocking by Reliance Industries Ltd (RIL) to cut debt, Facebook will get deeper access to India, the second-largest internet market after China.Facebook already has over 400 million WhatsApp users in India and is looking to launch a payment offering. Having a local partner could help it in navigating various regulatory issues, including those related to privacy and local storage.""And in the days to come, this winning recipe to serve other key stakeholders of Indian society. Our kisans (farmers), our small and medium enterprises, our students and teachers, our healthcare providers and above our women and youth who formed the foundation of a new India,"" Ambani, chairman and managing director of RIL said.He said at the core of the Jio-Facebook partnership is the commitment that Mark Zukerberg, founder of Facebook and he share for the all-round digital transformation of India for serving all Indians.""Together, our two companies will accelerate India's digital economy to empower you, to enable you and to enrich you. Our partnership will be a great catalyst to make India the world's leading digital society,"" he said.Facebook, WhatsApp and Instagram have become household names in India over the last few years.""WhatsApp, in particular, has entered our people's daily vocabulary in all the 23 official languages of India. WhatsApp is not just a digital application. It has become aapka aur hum sabka, pyara dost. A friend who brings together families, friends, businesses, information-seekers and providers,"" he said. ",https://timesofindia.indiatimes.com/business/india-business/jio-facebook-deal-looks-at-local-level-e-commerce-to-cover-education-health-gradually-mukesh-ambani/articleshow/75287315.cms,0
22-04-2020,1206.919189,1266.259399,1188.632568,1246.784058,1229.05127,71341683.0,RI,2020-04-22T10:54:00+05:30,TIMESOFINDIA.COM,Facebook-Jio deal: What Mukesh Ambani and Mark Zuckerberg want you to know,Facebook and Reliance Jio will work closely to ensure that you are able to access the nearest kiranas who can provide products and services to their h,"NEW DELHI: Social media giant Facebook has invested Rs 43,574 crore into Jio Platforms. Facebook’s investment will translate into a 9.99% equity stake in Jio Platforms on a fully diluted basis. The companies will work together to connect local kirana shops to sell online by transacting with a new platform called JioMart using WhatsApp.READ ALSO: Level the field: News producers can’t keep incurring the costs while digital platforms drain away profitsHere’s what Facebook CEO and cofounder Mark Zuckerberg has to say: India is home to the largest communities on Facebook and WhatsApp, and a lot of talented entrepreneurs. The country is in the middle of a major digital transformation and organisations like Jio have played a big part in getting hundreds of millions of Indian people and small businesses online.This is especially important right now, because small businesses are the core of every economy and they need our support. India has more than 60 million small businesses and millions of people rely on them for jobs. With communities around the world in lockdown, many of these entrepreneurs need digital tools they can rely on to find and communicate with customers and grow their businesses. This is something we can help with -- and that's why we're partnering with Jio to help people and businesses in India create new opportunities.Mukesh Ambani, Chairman and Managing Director, Reliance Industries: “When Reliance launched Jio in 2016, we were driven by the dream of INDIA’S DIGITAL SARVODAYA – India’s Inclusive Digital Rise to improve the quality of life of every single Indian and to propel India as the world’s leading Digital Society. All of us at Reliance are therefore humbled by the opportunity to welcome Facebook as our long-term partner in continuing to grow and transform the digital ecosystem of India for the benefit of all Indians. The synergy between Jio and Facebook will help realise Prime Minister Shri Narendra Modi’s ‘Digital India’ Mission with its two ambitious goals — ‘Ease of Living’ and ‘Ease of Doing Business’ – for every single category of Indian people without exception. In the post-Corona era, I am confident of India’s economic recovery and resurgence in the shortest period of time. The partnership will surely make an important contribution to this transformation.”",https://timesofindia.indiatimes.com/gadgets-news/facebook-jio-deal-what-mukesh-ambani-and-mark-zuckerberg-wants-you-to-know/articleshow/75286373.cms,0
22-04-2020,1206.919189,1266.259399,1188.632568,1246.784058,1229.05127,71341683.0,RI,2020-04-22T08:54:00+05:30,Reuters,Facebook to buy 10% stake in Reliance Jio for $5.7 billion,"India Business News: Facebook Inc announced a $5.7 billion investment in Reliance Industries Ltd's telecom unit on Wednesday, making it the largest minority shareholder in","BENGALURU: Facebook will buy a 10% stake in the digital business of Reliance Industries for $5.7 billion, as the social media firm looks to leverage its highly popular WhatsApp chat service to offer digital payment services.The deal will help the Reliance Industries cut debt that has piled up in its expensive push to secure top spot for its Jio Infocomm telecom business.Facebook's investment will make it the largest minority shareholder in Jio Platforms Ltd, Jio said in a statement on Wednesday, putting the enterprise value of the business at around $66 billion. Jio Platforms holds a host of Reliance's digital assets including Jio Infocomm.Blog: Level the field - News producers can’t keep incurring the costs while digital platforms drain away profitsWhatsApp is trying to secure approval to roll out its digital payment service in India, which will see it compete in a crowded market with the likes of Google Pay and Paytm. The approval to expand beyond the beta launch hasn't come through yet, a Facebook spokesman said.The messaging service has 400 million users in India, its biggest market, reaching nearly 80% of smartphone users in the country. The deal will also help the social media giant leverage WhatsApp to partner with Reliance's e-commerce marketplace JioMart, that connects small businesses to customers.""(India) is in the middle of a major digital transformation and organizations like Jio have played a big part in getting hundreds of millions of Indian people and small businesses online,"" Facebook founder CEO Mark Zuckerberg said in a post.For Reliance, whose debt pile swelled to more than $40 billion as of September, the partnership will bring in much needed funds to make good on its promise to cut net debt to zero by March 2021.Reliance Industries, controlled by billionaire Mukesh Ambani, is also set to sell a fifth of its oil and chemical refining business to Saudi Aramco for roughly $15 billion, and a stake in its telecom tower assets to Canadian private equity firm Brookfield Asset Management for over $3 billon.While Jio has become the country's largest wireless operator within about three years of its launch, Mumbai-headquartered Reliance has also rapidly expanded its retail business, which now has over 10,000 stores selling groceries, consumer electronics and apparel.Revenue at these two businesses together jumped more than 25% in the December quarter.Last month, it was reported that Facebook was in talks for a 10% stake in Jio but the talks were halted due to global travel bans amid the coronavirus outbreak.Jio said Morgan Stanley was the financial adviser on the deal. AZB & Partners, and Davis Polk & Wardwell were counsels.",https://timesofindia.indiatimes.com/business/india-business/facebook-invests-5-7-billion-in-reliance-jio/articleshow/75283747.cms,2
23-04-2020,1250.212891,1267.128052,1237.366455,1253.45874,1235.630859,32732251.0,RI,2020-04-23T17:31:00+05:30,Digbijay Mishra,"After RIL’s kirana play, Amazon moves to woo neighbourhood stores","India Business News: A day after Reliance Industries chairman Mukesh Ambani's announcement of Jio and WhatsApp's commerce initiative involving kiranas, or local grocery st","BENGALURU: A day after Reliance Industries chairman Mukesh Ambani's announcement of Jio and WhatsApp's commerce initiative involving kiranas, or local grocery stores, e-commerce major Amazon has made its next move. And local retailers are at the heart of it as well. The local arm of the Seattle-based e-tailer said it has on-boarded 5,000 offline retailers across categories on its platform under what it calls 'Local Shops'. Started as a pilot six months back, local standalone stores selling grocery, consumer electronics ,apparel and other products are live on Amazon across metro and non-metro markets like Delhi, Mumbai,Bengaluru, Ahmedabad, Jaipur, Coimbatore, Surat, Indore and Lucknow. This also includes relatively better known retailers like Sangeetha Electronics, Croma, Vishal Megamart among others.The local stores selling online would also fulfill most of the deliveries on their own as they would be enabled with Amazon's technology to serve local orders first based on pin-codes where they can deliver the same day or next day. If a retailer is willing to sell nationally, they will be able to sell through Amazon’s fulfillment services. Gopal Pillai, head of seller services, Amazon India, said the company would be committing about Rs 10 crore for the Local Shops programme to scale it up further. “This would leverage the best of local stores and Amazon’s network. Local stores are known for fast deliveries within short distances while Amazon’s wide reach would bring more traffic to these retailers, who have good stock availability. A retailer can choose to deliver certain pincodes on its own or by hiring a third-party, and rest can be done through Amazon---in a different part of the same city or other cities,” Pillai said. In light of ongoing lockdown due to the virus outbreak, this could plug the drop in footfall at stores partially, at least, he added. Over the last one month, kiranas and local shops have come to the rescue of Indian consumers as the lockdown crippled the supply chain of essentials across large-scale retail stores while online platforms struggled to fulfill rising demand of essentials. On Wednesday Ambani said nearly 3 crore kiranas in the near future will be able to transact digitally with their consumers in their neighbourhood through JioMart -- the new commerce platform which it has already launched in Mumbai's suburbs like Navi Mumbai and Thane. The orders are expected to be placed through WhatsApp. This is being seen as a potential game-changer for how online-to-offline (O2O) commerce could work. With Amazon’s serious play, going forward, this space would see an intense action. Amazon founder Jeff Bezos, earlier in January, announced a $1 billion investment in India to digitise small and medium businesses by 2025. The company has already invested over $7 billion in this market. TOI reported on Thursday saying Reliance has already started roping in kiranas in its network by offering them merchandise, working capital loans, and digital payment solutions, including point-of-sale (PoS) machines.",https://timesofindia.indiatimes.com/business/india-business/after-rils-kirana-play-amazon-moves-to-woo-neighbourhood-stores/articleshow/75323461.cms,2
23-04-2020,1250.212891,1267.128052,1237.366455,1253.45874,1235.630859,32732251.0,RI,2020-04-23T08:05:00+05:30,Bloomberg,Mukesh Ambani tops Jack Ma as Asia's richest after deal with Mark Zuckerberg,"India Business News: Ambani's fortune rose about $4.7 billion to $49.2 billion on Wednesday, after Reliance Industries Ltd gained 10%. The jump put Ambani about $3.2 billi","MUMBAI: Mukesh Ambani is again Asia's richest person after a deal with Mark Zuckerberg's Facebook Inc sent his conglomerate's stock surging.Ambani's fortune rose about $4.7 billion to $49.2 billion on Wednesday, after Reliance Industries Ltd gained 10%. The jump put Ambani about $3.2 billion ahead of China's Jack Ma, according to the Bloomberg Billionaires Index. The ranking updates after the close of each trading day in the US.Facebook Inc will invest $5.7 billion in the US social-networking giant's biggest deal since the 2014 purchase of WhatsApp as it seeks a broader foothold in its biggest global market. The US company will buy about 10% of Jio Platforms, which brings together digital apps and a wireless platform under one umbrella, the Mumbai-based company said in a statement Wednesday.Read also: Level the field — News producers can't keep incurring costs while digital platforms drain away profitsBefore Wednesday, Ambani — who owns the world's largest oil refinery — had declined by $14 billion on the index in 2020, the biggest dollar fall of anyone in Asia. Alibaba Group Holding Ltd.'s Ma, whose foundation this week donated 100 million masks to the World Health Organization to fight the Covid-19 pandemic, had lost almost $1 billion through Tuesday.""At the core of our partnership is the commitment that Mark Zuckerberg, founder of Facebook, and I share for the all-around digital transformation of India,"" Ambani said in a web video posted on Jio's Facebook page, adding that Facebook's brands have become household names in India. ""WhatsApp in particular, has entered our people's daily vocabulary in all the 23 official languages of India.""The partnership with Jio would allow Zuckerberg to step up his expansion in a country that is rapidly embracing online payment and e-commerce as more people get smartphones. Jio Infocomm quickly moved into a position of dominance by offering free plans and undercutting wireless market rivals.With its half-billion internet users, the South Asian country is a key market for the world's largest technology companies, including Amazon.com Inc., Apple Inc., Microsoft Corp. and Alphabet Inc.'s Google. In India, Facebook has about 250 million users, while WhatsApp has more than 400 million.That should help Jio bolster its reach, according to James Crabtree, author of ‘The Billionaire Raj,' a book on the country's wealthiest people. But the transaction also shows the extent of Ambani's own influence, he said.""This deal clearly shows that if you want to play big in Indian tech, you need to play nice with Mukesh Ambani.""",https://timesofindia.indiatimes.com/business/india-business/mukesh-ambani-tops-jack-ma-as-asias-richest-after-deal-with-mark-zuckerberg/articleshow/75310619.cms,0
23-04-2020,1250.212891,1267.128052,1237.366455,1253.45874,1235.630859,32732251.0,RI,2020-04-23T04:00:00+05:30,TNN,"Sensex gains 743 pts riding on RIL rally to end at 31,380",India Business News: Mumbai: A 10% rally in the Reliance Industries shares sent the sensex zooming 743 points on Wednesday with the energy-to-telecom major’s stock contrib.,"Mumbai: A 10% rally in the Reliance Industries shares sent the sensex zooming 743 points on Wednesday with the energy-to-telecom major’s stock contributing over half of the BSE benchmark’s gain, which closed at 31,380. The sensex opened slightly higher and as the RIL stock picked up gains through the session, the index scaled an intraday high of 31,471 and closed a tad off that mark, but still up 2.4%. Other stocks that contributed to the index’s gain were HUL, Asian Paints and TCS, while L&T, ONGC and HDFC closed in the red.The day’s gains came despite a Rs 1,326-crore net outflow by foreign funds, while domestic funds were net buyers at Rs 864 crore, BSE data showed.Most brokerages are positive on the Facebook-Jio deal since it primarily helps RIL reduce its debt burden by about 12%, something that has been an overhang on the stock price for long. This deal, at Rs 43,574 crore, along with the already announced Rs 7,000-crore deal with BP for RIL’s petro-retailing business, is expected to cut the company’s net debt by about 20%, foreign broking major CLSA said. The brokerage has a target price of Rs 1,500 for the stock, a 10% gain from RIL’s closing price on Wednesday.Nomura, another foreign broking house which has a Rs 1,770 price target on RIL, said the strong synergy benefits between Jio’s business and Facebook and the deal would allay investors’ worries about RIL’s large debt.",https://timesofindia.indiatimes.com/business/india-business/sensex-gains-743-pts-riding-on-ril-rally-to-end-at-31380/articleshow/75306998.cms,0
23-04-2020,1250.212891,1267.128052,1237.366455,1253.45874,1235.630859,32732251.0,RI,2020-04-23T04:00:00+05:30,"Digbijay Mishra,Madhav Chanchani",RIL plans to bring kiranas closer to you,"India Business News: At the centre of the Reliance-Facebook deal is the commercial partnership between Reliance Retail and WhatsApp to push out what it calls new commerce,","BENGALURU: At the centre of the Reliance-Facebook deal is the commercial partnership between Reliance Retail and WhatsApp to push out what it calls new commerce, which will allow consumers to order from neighbourhood kirana stores. The online-to-offline (O2O) commerce initiative could potentially change the landscape of retail, given WhatsApp’s reach of over 400 million customers in India.Reliance Industries chairman Mukesh Ambani said nearly 3 crore kiranas in the near future will be able to transact digitally with their consumers in their neighbourhood through JioMart — the new commerce platform, which it has already launched in Mumbai’s suburbs like Navi Mumbai and Thane. The orders are expected to be placed through WhatsApp, while Reliance had already started roping in kiranas in its network by offering them merchandise, working capital loans, and digital payment solutions, including point-of-sales (PoS) machines.  75307566The idea is to make the best of the “high-quality front end” of WhatsApp and Jio’s feet-on-the-street execution. “With this partnership what WeChat has done in China becomes a possibility. Facebook is a technology company and is not into handling logistics or moving goods, very clearly what they wanted was a partner who can handle all of it,” said a person involved in the transaction.  The mini-apps inside messaging app WeChat, which has 1.15 billion users, did business of $115 billion in 2019 in China across online retail, food delivery, ride-hailing, paying bills and booking tickets. Besides tie-ups with kiranas, Reliance has 11,316 stores across consumer electronics, fashion & lifestyle, and grocery (as of December quarter). The development comes as consumers, amid the virus outbreak, are starting to warm up to the idea of ordering essentials from their local shops through individual WhatsApp chats, albeit at a small scale.“They have started work on WhatsApp collaboration. While Ajio (fashion and lifestyle) is fully operating on the O2O model, Reliance is in the process of taking it to the wider retail businesses in other segments. The O2O model, where supply is linked with the inventory at nearby retail stores and not large warehouses, works better with unstructured categories, like grocery and other essentials,” a person aware of Reliance’s O2O plans said.Grocery is a thin-margin business and the model should be scalable, which has led to multiple pilots in different cities across the country, this person added.  75308253The cautious approach is preceded by on-ground challenges that companies in India have faced while trying the O2O model in the country. It hasn’t got the kind of traction that it did in China. “The opportunity is immense but the execution at every small store is critical. The demand pattern is different across cities and stocking adequately in right locations is a challenge. This would impact the timing of delivery — which is important for day-to-day items,” said a senior e-commerce executive who has worked on this model.All said, the final interface of JioMart and WhatsApp would play a differentiator as consumers are used to the easy-to-use design of how WhatsApp messaging works. To bring chat-based commerce and customer services, it would be a challenge to keep the design framework simple.Reliance’s bullishness on the model is further seen in a spate of acquisitions — Fynd, an O2O startup that was backed by Google; Grab, a hyper-local logistics company, and chatbot platform Haptik, among others.",https://timesofindia.indiatimes.com/business/india-business/ril-plans-to-bring-kiranas-closer-to-you/articleshow/75306938.cms,2
23-04-2020,1250.212891,1267.128052,1237.366455,1253.45874,1235.630859,32732251.0,RI,2020-04-23T03:08:00+05:30,Reeba Zachariah,Facebook deal may keep RIL on road to zero-debt plan,"India Business News: The $5.7 billion (Rs 43,574 cr) investment by Facebook in Jio Platforms will help Mukesh Ambani deleverage Reliance Industries’ (RIL) balance sheet ev","MUMBAI: The $5.7 billion (Rs 43,574 crore) investment by Facebook in Jio Platforms will help Mukesh Ambani deleverage Reliance Industries’ (RIL) balance sheet even as oil market uncertainties have cast a shadow on a potential multi-million-dollar investment by Saudi Aramco in its refining-to-chemicals business. RIL’s debt has ballooned to $43 billion (Rs 3.06 lakh crore) following its aggressive entry into the telecom sector four years ago. It has invested more than Rs 3.50 lakh crore in building digital infrastructure which included splurging on acquisitions. In the recent past, concerns were raised about RIL’s mounting liabilities but the company debunked those by saying it has a clear roadmap for debt reduction. Read also: Level the field — News producers can’t keep incurring costs while digital platforms drain away profitsAt the annual shareholder meet last year, Ambani announced plans to make RIL a “zero net debt” company by March 31, 2021. But, legal roadblocks, among other factors, have hindered his asset monetisation deals. Last August, RIL had said that it will complete the $15 billion investment by Saudi Aramco by March but a closure to the deal seems to be away.  75314658Analysts believe that RIL is on track to reduce its net debt this fiscal after Jio Platforms’ deal with Facebook and its fuel retail joint venture (JV) with BP got the European Union regulator’s approval on Monday. RIL will receive Rs 7,000 crore from BP in lieu of the 49% stake in the JV and the deal is expected to be closed this quarter.  75307566“The two transactions will accelerate RIL’s deleveraging story and give the company more time to work in closing other deals involving Aramco and Brookfield (in telecom towers),” said Narendra Solanki, head-equity research, Anand Rathi Shares & Stock Brokers. RIL is also looking to unlock value in its entertainment channel business and has held talks with Sony Corporation for the same. RIL has a net debt of Rs 1.53 lakh crore ($20 billion) and according to foreign brokerage firm CLSA, the company’s net debt will come down by 20% in this quarter. “Leverage is getting more manageable and concerns around this should diminish,” wrote CLSA in its report post the Facebook-Jio Platforms announcement. Of the total $5.7 billion investment by Facebook, Jio Platforms will retain $2.14 billion (Rs 15,000 crore), while the remaining $4.08 billion (Rs 28,574 crore) will be used to retire debt it owes to RIL. “The Facebook deal will be a major cash boost for RIL since the current uncertainties in the crude oil market may cast a shadow on its deal with Aramco,” said Rajeev Shah, MD, RBSA Advisors. Ambani had said last year that there is a strong investor interest in the retail business and will induct a partner before taking the unit public.",https://timesofindia.indiatimes.com/business/india-business/facebook-deal-may-keep-ril-on-road-to-zero-debt-plan/articleshow/75308253.cms,1
23-04-2020,1250.212891,1267.128052,1237.366455,1253.45874,1235.630859,32732251.0,RI,2020-04-23T02:23:00+05:30,"Reeba Zachariah,Madhav Chanchani","Jio accepts FB friend request, sells 10% stake for record Rs 43,574 crore","India Business News: Social media giant Facebook has agreed to invest $5.7 billion or Rs 43,574 cr for a 9.99% stake in Jio Platforms, a unit of Reliance Industries (RIL).","MUMBAI/BENGALURU: In what is being touted as the largest strategic investment for a minority stake by a technology company anywhere in the world, social media giant Facebook has agreed to invest $5.7 billion or Rs 43,574 crore for a 9.99% stake in Mumbai-based Jio Platforms, a unit of Reliance Industries (RIL). Between Jio's last reported subscriber base of 388 million and the 700 million-plus Indian users on the three FB platforms – Facebook, WhatsApp and Instagram – their combined reach will be well over a billion, albeit with considerable overlap.The transaction gives Mark Zuckerberg, Facebook CEO and the world’s seventh richest man according to Forbes, an opportunity to deepen FB’s presence in India, which is its largest market in terms of users and where Mukesh Ambani, India’s richest man, has upended the telecom industry with cheap data plans.75312717“At the core of our partnership is the commitment that Mark Zuckerberg and I share for the all-round digital transformation of India,” said Ambani, chairman, RIL, in a video message. RIL believes that comprehensive digitalisation will be an absolute necessity to revitalise the Indian economy in the post pandemic era.Zuckerberg said there’s more to the financial investment it is making in Jio Platforms. “We are committing to work together on some major projects that will open up commerce opportunities across India,” he said on his FB page.Read also: Level the field — News producers can’t keep incurring costs while digital platforms drain away profitsThe transaction, which is among the largest FDI deals in India’s technology sector, will help RIL cut its $43 billion debt as about $4.1 billion is expected to be paid back by Jio Platforms to parent RIL. The Facebook investment values Jio Platforms--which runs apps like JioSaavn and JioCinema and holds investments in Reliance Jio Infocomm, operator of the world’s third largest mobile services network—at $57 billion (and $66 billion based on Reliance’s assumption of an exchange rate of Rs 70/$).If Jio Platforms were to be listed today, it would be the fifth most valued company in India after RIL, TCS, Hindustan Unilever and HDFC Bank. It is valued higher than India’s second and third largest technology companies - Infosys and Wipro - combined. Jio Platforms will also be 70% more valuable than its closest rival Bharti Airtel, which had a closing market capitalisation of Rs 2.73 lakh crore on Wednesday.In October 2019, RIL consolidated the digital platform business under a separate subsidiary to mirror the structure of global companies like Alphabet-Google, Tencent and Alibaba which are largely debt-free, making it easier to attract investors into the new entity.75312727The RIL-FB transaction has been in the works since last year, with the first few meetings between the top teams including Ambani and Zuckerbeg revolving around understanding the potential areas of business collaboration. The conversations progressed with the initial target of closing the deal on March 31. But the outbreak of Covid-19 delayed the final lap of due-diligence.Facebook will get a board seat and an “observer seat” on Jio Platforms. The deal is a binding agreement, according to RIL, but will need approval from antitrust watchdog Competition Commission of India. The announcement boosted RIL’s shares to close at Rs 1,363.6, up by 10.2% on the NSE. The deal will also see a tie-up between RIL’s retail unit and Facebook’s WhatsApp to leverage each other's platforms to allow consumers to order items from their local kirana stores. This would enable Facebook to monetise its large user base, while also potentially serve as a platform to drive adoption of its payment business under WhatsApp which will compete with Google Pay, Alibaba and Softbank-backed Paytm and Walmart-owned Phonepe.“India has more than 60 million small businesses and millions of people rely on them for jobs. With communities around the world in lockdown, many of these entrepreneurs need digital tools they can rely on to find and communicate with customers and grow their businesses,” Zuckerberg said.Ambani, said industry observers, wants Jio to be known as a digital services platform like US-based Google and China’s Alibaba, and not just as a telecom player. Digital services contributed 25% to RIL’s operating profit for the nine months of fiscal 2020.Morgan Stanley and AZB Partners advised Jio Platforms on the deal while Bank of America-Merrill Lynch assisted Facebook",https://timesofindia.indiatimes.com/business/india-business/jio-accepts-fb-friend-request-sells-10-stake-for-record-rs-43574-crore/articleshow/75307566.cms,0
24-04-2020,1234.486328,1366.881714,1231.789063,1295.609497,1277.182373,67493154.0,,,,,,,,-1
27-04-2020,1311.153076,1348.640747,1301.095459,1307.267212,1288.674316,29241450.0,RI,2020-04-27T21:40:00+05:30,PTI,"All locked down, but dealmakers ensure show must go on; billion-dollar deals aplenty for right biz","India Business News: A US-based cruise operator raised billions of dollars when its end market is virtually shut, at least for a few months, and a Malaysian oil firm did t","NEW DELHI: A US-based cruise operator raised billions of dollars when its end market is virtually shut, at least for a few months, and a Malaysian oil firm did the same irrespective of what is happening to crude prices, while closer home Reliance Industries has also got billions from Facebook for its Jio Platforms.Asia's oldest bourse BSE is also busy helping several startups and SMEs get listed and also help companies raise more than Rs 50,000 crore through corporate bonds and commercial papers, and all this is happening when there is a nationwide lockdown and virtually the entire world is also locked down.Living up to the concept of the new emerging theme of doing business digital way, literally, dealmakers are doing quite a few deals remotely with almost all of them working from home and helping companies raise funds through bonds and equity, and also sign M&A deals without making them feel about disadvantages of not working from physical offices and without those endless face-to-face meetings.Investment bankers feel nothing can match working from office, but some of them have managed to reach 'work from home' efficiency of as high as 90-95 per cent of what could have been done if they were working from office.Raj Balakrishnan, Bank of America Merrill Lynch's investment banking head in India, said he and his colleagues feel ""blessed"" to be able to work with a great deal of efficiency even from home during the lockdown, as they fully recognise that there is a broader economy and there are people, including doctors, health workers, police and even journalists, and companies providing essential services out there and doing a lot of work.""Fortunately, most large banks and most large companies in India are pretty well equipped to have all their critical functions and departments work from home. All of us have remote access and most records are today stored digitally. And therefore, while it is obviously not the same as working in the office, I guess we in the finance world are lucky that we can work from home and can operate with a great deal of efficiency,"" Balakrishnan told PTI in an interview over telephone.Bank of America Merrill Lynch has managed a number of equity and debt market deals in India in the recent past, including SBI Card IPO, HDFC Life block deal, Avenue Supermarts share placements and a US debt placement worth $310 million for Adani Transmission.Globally, it has helped Petronas and Carnival Cruises raise funds, among other big deals.Giving a perspective about the lockdown and its impact on investment banking business globally and in India, Balakrishnan said most of the world is under lockdown right now and China is the only place where people have started coming back to office, but they went into lockdown in January itself and they are getting back after more than three months.""We (in India) have been under lockdown for only one month,"" he said.The veteran investment banker said while markets corrected significantly, most companies across the world went out and drew down their credit lines and improved their liquidity positions.Secondly, as soon as markets started falling, bond markets almost shut down for a while after a very strong bond market activity through January and February, he said.""But, the bond market rallied quickly around the middle of March. Through the second half of March and April, we had a very strong period for global investment grade bonds. Highly rated companies with investment grade ratings, went out and tapped the bond market and raised liquidity. So, after drawing on revolving credit lines, bond market fund raising happened,"" he said.Similarly, deal activity began in the US and spread to Europe and then to other places. Last week, Bank of America helped Petronas -- despite the stress in oil prices -- successfully raise $6 billion from the bond market. This indicates that for a quality issuer, even for a hard hit sector, a large bond offering even now, Balakrishnan said.He further said the leveraged finance market has also begun seeing a revival, while companies have started raising equity and doing other equity-linked transactions.""One major transaction Bank of America did in this space recently is for a US-based cruise company, Carnival Cruises,"" he said.""In India, we have had an excellent run in the last four months. In March, we successfully reopened the Indian equity capital markets by pricing a $300 million block trade in HDFC Life for Standard Life Aberdeen on a sole basis.""Also, we helped SBI Cards raise $1.4 billion via an IPO, which was the largest in the last ten years. In February also, we had helped D-Mart raise over $1 billion through a QIP and an OFS route,"" he said.Balakrishnan said many companies are right now waiting to declare their results and after that they will look to raise funds through equity or bonds and shore up their capital structure. At the same time, M&A dialogues continue as companies evaluate assets and deals which are of strategic importance.""Deals which made strategic sense before COVID-19 will do so even after COVID-19 too,"" he added.",https://timesofindia.indiatimes.com/business/india-business/all-locked-down-but-dealmakers-ensure-show-must-go-on-billion-dollar-deals-aplenty-for-right-biz/articleshow/75413360.cms,2
28-04-2020,1325.782471,1330.765503,1272.888306,1305.804321,1287.232056,39226700.0,RI,2020-04-28T07:49:00+05:30,John Sarkar,Jio-Facebook alliance may go beyond kirana stores,India Business News: The partnership between India’s largest conglomerate Reliance Industries and US social media giant Facebook could expand beyond the scope of just onbo,"NEW DELHI: The partnership between India’s largest conglomerate Reliance Industries and US social media giant Facebook could expand beyond the scope of just onboarding kirana stores for JioMart through the WhatsApp platform, sources said.Apart from using the messaging app WhatsApp, going forward, Reliance could leverage other online platforms of Facebook group, such as Instagram and Facebook, to push its other retail brands, including Reliance Brands, Reliance Trends and Reliance Digital.“It could turn out to be an enterprise level play for Reliance in the long term and could benefit both partners,” said the CEO of a global apparel brand. “Millennials, for instance, are on Instagram and brands under Reliance Brands could leverage that platform. In contrast, Reliance Trends, which is into more affordable products, can use the Facebook platform to reach out to more consumers.”Questionnaires emailed to Reliance Retail and Facebook did not elicit responses till the time of going to the press.Commenting on the deal, for which Facebook is paying around $5.7 billion for buying 10% in the digital arm of Reliance, a Credit Suisse report on Monday said the partnership could later be extended into other retail categories such as medicine distribution, fashion & lifestyle stores and food delivery, as the Jio investment signals social media giant’s intention of capturing India’s vast ecommerce potential.The investment provides Facebook with a chance to onboard the large small and medium businesses and drive ecommerce via the JioMart venture, the report showed.",https://timesofindia.indiatimes.com/business/india-business/jio-facebook-alliance-may-go-beyond-kirana-stores/articleshow/75419265.cms,0
28-04-2020,1325.782471,1330.765503,1272.888306,1305.804321,1287.232056,39226700.0,RI,2020-04-28T04:00:00+05:30,"Reeba Zachariah,Partha Sinha",RIL to finalise first rights offer in 29 years on April 30,India Business News: Reliance Industries (RIL) is planning a rights issue — its first fund-raise from the public in 29 years. The company has not disclosed the amount of m,"MUMBAI: Reliance Industries (RIL), India’s most valued company, is planning a rights issue — its first fund-raise from the public in 29 years. The company has not disclosed the amount of money it plans to raise through the rights offer, or any other details about it.Through a stock exchange notice on Monday, RIL said its board will meet on April 30 to “consider a proposal to issue equity shares to existing shareholders on rights basis”. Early this month, RIL had said that the board had approved a proposal to raise Rs 25,000 crore through non-convertible debentures (NCDs).RIL chairman Mukesh Ambani will lead a board meeting on Thursday to consider the proposal of issuing new shares to existing shareholders, currently numbering over 23 lakh, according to data from the BSE. Ambani and his family owns 50% in RIL, which currently has a market capitalisation of nearly Rs 9.1 lakh crore.  75416764During rights offers, the promoters can avoid diluting their stake in the company by subscribing to their share of quota in the offer. In case other shareholders do not subscribe to their individual quota, even those shares could be bought by existing shareholders, including the promoters.The RIL’s rights issue proposal comes days after it inked India’s largest FDI deal, in the technology sector, with social media giant Facebook to raise Rs 43,574 crore by selling 9.9% in Jio, its digital platform business. Analysts see the rights issue proposal as RIL’s move to reduce its debt of $43 billion further. RIL had also planned to use the proceeds from the sale of its stake in Jio Platforms to deleverage its balance sheet.The last time RIL tapped the public for funds was in 1991 when it had issued convertible debentures. The debentures were subsequently converted into equity shares at Rs 55 apiece.Apart from the rights issue proposal, the board of RIL will also consider the financial statements of the $90-billion explorations-to-telecom company. Fiscal 2020’s fourth quarter results of RIL’s core business could be impacted as demand for transportation fuels have slumped due to the Covid-19 outbreak. Retail (specifically grocery) and telecom could see limited impact because of the increased consumption during the lockdown.",https://timesofindia.indiatimes.com/business/india-business/ril-to-finalise-first-rights-offer-in-29-years-on-apr-30/articleshow/75416765.cms,2
29-04-2020,1321.119385,1329.119751,1298.352417,1304.707031,1286.150513,18747336.0,,,,,,,,-1
30-04-2020,1329.394043,1366.881714,1314.856201,1340.411743,1321.347168,35672949.0,RI,2020-04-30T20:02:00+05:30,PTI,"Jio Q4 net profit zooms 177 pc to Rs 2,331 crore","India Business News: Reliance Jio on Thursday posted 177.5% year-on-year rise in net profit to Rs 2,331 crore for the three months ended March 31, fuelled by rising subscr","NEW DELHI: Reliance Jio on Thursday posted 177.5 per cent year-on-year rise in net profit to Rs 2,331 crore for the three months ended March 31, fuelled by rising subscriber base and recent tariff hike.The net profit of Jio stood at Rs 840 crore in the year-ago period.Seen sequentially, the net profit grew 72.7 per cent when compared to Rs 1,350 crore in December quarter (Q3FY20).Jio's standalone revenue from operations for the fourth quarter stood at Rs 14,835 crore, which translates into year-on-year growth of 26.6 per cent.Commenting on the Q4 results, Mukesh Ambani, Chairman and Managing Director, Reliance Industries Limited said, ""Jio is embarking on the next leg of growth with a path-defining partnership with one of the world's largest digital companies, Facebook"".""We are together determined to make India a truly digital society with best-in-class connectivity network complemented with disruptive digital technology platforms for entertainment, commerce, communication, finance, education and health harnessing world's best tech capabilities. Our focus will be India's 60 million micro, small and medium businesses, 120 million farmers, 30 million small merchants and millions of small and medium enterprises in the informal sector,"" he said.The standalone net profit stood at Rs 2,331 crore, the company in a statement said, adding that there was exceptional item (income) during the quarter of Rs 31 crore related to reversal of provisions on AGR dues.Average Revenue Per User (or earning per subscriber) was sequentially higher at Rs 130.6 per month, the company said, adding that further impact of December 2019 tariff hike will flow through in coming months.Jio's net profit increased to Rs 5,562 crore for the full year FY20 from Rs 2,964 crore in the previous fiscal, an annual increase of 88 per cent, the statement said.The revenue from operation stood at Rs 54,316 crore for FY20, up from Rs 40,663 crore in FY19.Subscriber base as on March 31, 2020 was at 387.5 million with net addition of 17.5 million during 4QFY20, it said.Jio Platforms will launch a nationwide video platform called 'JioMeet', the company said.",https://timesofindia.indiatimes.com/business/india-business/jio-q4-net-profit-zooms-177-pc-to-rs-2331-crore/articleshow/75475443.cms,0
30-04-2020,1329.394043,1366.881714,1314.856201,1340.411743,1321.347168,35672949.0,RI,2020-04-30T16:05:00+05:30,PTI,Reliance cuts employees' salary by 10-50%; Mukesh Ambani to forgo entire remuneration,"India Business News: With coronavirus lockdown hitting businesses hard, India's largest company Reliance Industries has decided to cut the salary of most of its employees ","NEW DELHI: With coronavirus lockdown hitting businesses hard, India's largest company Reliance Industries has decided to cut the salary of most of its employees by 10 to 50 per cent with firm's chairman and richest Indian Mukesh Ambani agreeing to forgo all his remuneration.Also, the oil-to-technology conglomerate has deferred annual cash bonus and performance-linked incentives that are normally paid in the first quarter, according to an employee communique.The nationwide lockdown that began on March 25 had led to evaporation of demand as factories shut down, offices closed, air flights suspended, trains stopped and restrictions on the movement of people and goods placed.Coronavirus outbreak: Live updatesReliance's hydrocarbon business was adversely impacted due to a reduction in demand for refined products and petrochemicals.The company's different vertical heads wrote to their employees about the salary cut decision.""This has, of course, put pressure on our hydrocarbons business necessitating optimisation and cost reduction across all fronts,"" it said. ""The situation demands that we maintain a razor-sharp focus on operating costs and fixed costs and all of us need to contribute to making this happen.""While Ambani will forgo his entire Rs 15 crore compensation, Reliance board of directors including executive directors, executive committee (EC) members, and senior leaders will forgo 30 to 50 per cent of their compensation.More on Covid-19Coronavirus pandemic: Complete Coverage21-day lockdown: What will stay open and what won'tHow to quarantine yourself at homeTrust the newspaper for your daily verified news Employees with compensation of less than Rs 15 lakh will have no reduction in compensation but those earning higher than that could see a 10 per cent reduction in fixed pay.Ambani draws Rs 15 crore in annual compensation for being chairman and managing director of India's largest company. His salary has remained unchanged since 2008-09, forgoing over Rs 24 crore per annum.""We will closely monitor the economic and business environment, re-evaluate our response to the situation on a continuous basis and strive to improve the earning capacity of our business,"" it said.The lockdown period, the company communique said, has also provided several opportunities to reorganise and digitalise business processes to generate significant improvements in productivity, efficiency and costs.""Together, we will embrace these opportunities and work towards restoring our compensation levels to normalcy,"" it said.The communication said the firm's various initiatives on all fronts will help it strengthen organisation to become more resilient in coping with business uncertainties in a volatile and uncertain world. They will help us navigate through these challenging times with agility and emerge as industry leaders and as accretors of top talent. ",https://timesofindia.indiatimes.com/business/india-business/reliance-cuts-pay-of-executives-in-oil-gas-division-report/articleshow/75470411.cms,0
30-04-2020,1329.394043,1366.881714,1314.856201,1340.411743,1321.347168,35672949.0,RI,2020-04-30T12:23:00+05:30,Agencies,"Reliance Industries Q4 results today, stock up nearly 4%",India Business News:  The company is going to release its fourth-quarter earnings report today evening. ,"NEW DELHI: Oil-to-retail conglomerate Reliance Industries Ltd rose 3.3% ahead of its quarterly results on Thursday, April 30, 2020, supported by an over 10% surge in oil prices on signs of a recovery in the US fuel demand. The company is going to release its fourth-quarter earnings report today evening. At 12:14 pm on April 30, the shares of the Reliance Industries Limited traded at Rs 1,483.70, up Rs 56.75 or 3.98 per cent on National Stock Exchange. The stock opened at Rs 1,453.95 and touched an intraday high and low of Rs 1,486.40 and Rs 1,438.05, respectively, in the session so far. As per market experts, Reliance Industries is expected to report soft earnings for March quarter due to COVID-19's impact on the refinery and retail businesses across the globe. However, it may get strong support from Jio business. Here are the key things to watch out for in Reliance Industries Q4 earnings report:Net profitRevenue and EbitdaJio Q4 resultsManagement commentary on debt reduction planUpdates on RIL's retail business",https://timesofindia.indiatimes.com/business/india-business/reliance-industries-q4-result-today-stock-up-nearly-4/articleshow/75466558.cms,0
30-04-2020,1329.394043,1366.881714,1314.856201,1340.411743,1321.347168,35672949.0,RI,2020-04-30T18:58:00+05:30,TIMESOFINDIA.COM,"Reliance Industries Q4 net profit falls 39% to Rs 6,348 crore",India Business News: Oil to telecom major Reliance Industries (RIL) on Thursday reported a per cent 39 per cent fall in its consolidated net profit for the fourth quarter ,"NEW DELHI: Oil to telecom major Reliance Industries (RIL) on Thursday reported a per cent 39 per cent fall in its consolidated net profit for the fourth quarter (Q4) ended March 2020 on weak energy and petrochemical business.RIL posted a profit of Rs 6,348 crore in Q4 as against a net profit of Rs 10,362 crore posted in the same period last year, the company said in a regulatory filing.In terms of quarter-on-quarter growth, RIL posted a 45 per cent slump in net profit as compared to Rs 11,640 crore recorded for the third quarter ended December 31, 2019.In a statement, Reliance said it was accounting for ""inventory holding losses in the energy businesses due to the dramatic drop in oil prices accompanied with unprecedented demand destruction due to COVID-19.""The company announced a rights issue of Rs 53,125 crore, which it said was the biggest in India. The ratio would be 1:15 at a price of Rs 1,257. The promoter and promoter group of RIL will subscribe to the full extent of their aggregate rights entitlement. In addition, they will also subscribe to all the unsubscribed shares in the issue.The company's revenue from operations also witnessed a 2.3 per cent slump to Rs 1,39,283 crore, compared to a profit of Rs 1,42,565 crore posted in Q4 of last year.Meanwhile, RIL's digital arm Jio reported a 177 per cent jump in fourth quarter net profit to Rs 2,331 crore.The telecom venture of billionaire Mukesh Ambani had logged a net profit of Rs 840 crore in the same quarter last year.(With agency inputs)",https://timesofindia.indiatimes.com/business/india-business/reliance-industries-q4-net-profit-falls-39-to-rs-6348-crore/articleshow/75474160.cms,1
30-04-2020,1329.394043,1366.881714,1314.856201,1340.411743,1321.347168,35672949.0,RI,2020-04-30T14:30:00+05:30,TIMESOFINDIA.COM,Reliance Industries to consider rights issue: All you need to know,"India Business News: India's most valued company, Reliance Industries (RIL) may consider its first rights issue in almost 30 years in a board meeting to be held on Thursda","NEW DELHI: India's most valued company, Reliance Industries (RIL) may consider its first rights issue in almost 30 years in a board meeting to be held on Thursday. However, the company has not yet disclosed the amount of money it plans to raise through the rights offer.The board of RIL will meet to consider and approve audited financial results of the firm for the quarter and year ended March 31 as also to recommend dividend, the company had said in a regulatory filing on April 27.Early this month, RIL had said that the board had approved a proposal to raise Rs 25,000 crore through non-convertible debentures (NCDs).Here are some key points about rights issue:What is a rights issue?A listed company can raise additional capital by issuing equity shares to existing shareholders on a rights basis. In other words, it is an invitation to existing shareholders of the company to purchase additional shares.How are the shares alloted?The offer is required to be made to the existing shareholders on pro-rata basis to their existing holdings. The shareholders have the power to renounce the shares offered to any other person who need not be an existing shareholder of the company. Who decides the terms and conditions of the issue?The board of directors of a company decide the time, price, number of shares, pro-rata and other terms and conditions of the issue. What is the price level of shares issued?The price at which the new shares are issued through rights issue is generally less than the current market price or at a discount.When do companies opt for rights issue?A company usually opts for a rights issue when it requires funds for corporate expansion or large takeovers.",https://timesofindia.indiatimes.com/business/india-business/reliance-industries-to-consider-rights-issue-all-you-need-to-know/articleshow/75468717.cms,2
30-04-2020,1329.394043,1366.881714,1314.856201,1340.411743,1321.347168,35672949.0,RI,2020-04-30T12:23:00+05:30,Agencies,"Reliance Industries Q4 results today, stock up nearly 4%",India Business News:  The company is going to release its fourth-quarter earnings report today evening. ,"NEW DELHI: Oil-to-retail conglomerate Reliance Industries Ltd rose 3.3% ahead of its quarterly results on Thursday, April 30, 2020, supported by an over 10% surge in oil prices on signs of a recovery in the US fuel demand. The company is going to release its fourth-quarter earnings report today evening. At 12:14 pm on April 30, the shares of the Reliance Industries Limited traded at Rs 1,483.70, up Rs 56.75 or 3.98 per cent on National Stock Exchange. The stock opened at Rs 1,453.95 and touched an intraday high and low of Rs 1,486.40 and Rs 1,438.05, respectively, in the session so far. As per market experts, Reliance Industries is expected to report soft earnings for March quarter due to COVID-19's impact on the refinery and retail businesses across the globe. However, it may get strong support from Jio business. Here are the key things to watch out for in Reliance Industries Q4 earnings report:Net profitRevenue and EbitdaJio Q4 resultsManagement commentary on debt reduction planUpdates on RIL's retail business",https://timesofindia.indiatimes.com/business/india-business/reliance-industries-q4-result-today-stock-up-nearly-4/articleshow/75466558.cms,0
04-05-2020,1316.63916,1339.497437,1296.020874,1312.250366,1293.586426,26728434.0,RI,2020-05-04T09:12:00+05:30,Pankaj Doval,"After Facebook deal, Mukesh Ambani’s Jio Platforms bags Rs 5,656 cr investment from Silver Lake","India Business News: Days after the mega Facebook deal in its digital arm Jio Platforms, Mukesh Ambani’s Reliance group on Monday announced a Rs 5,656 crore fresh investme","NEW DELHI: Days after the mega Facebook deal in its digital arm Jio Platforms, Mukesh Ambani’s Reliance group on Monday announced a Rs 5,656 crore fresh investment by US private equity firm Silver Lake, at a 12.5% premium over the last transaction.Facebook had invested Rs 43,574 crore in Jio Platforms on April 22, and the fresh deal displays the growing interest of global investors into Jio Platforms’ business, that is also the holding company for Reliance Jio, the country’s biggest telecom company.Commenting on the transaction, Mukesh Ambani, chairman and managing director of Reliance Industries, said, “Silver Lake has an outstanding record of being a valuable partner for leading technology companies globally. Silver Lake is one of the most-respected voices in technology and finance. We are excited to leverage insights from their global technology relationships for the Indian digital society’s transformation.”Silver Lake is a global leader in technology investing, with over $43 billion in combined assets under management and committed capital and a team of approximately 100 investment and operating professionals located around the world. Companies where it has invested previously include Alibaba group, Airbnb, Dell, Didi Chuxing, Hyla Mobile, Ant Financial, Alphabet’s Verily and Twitter. Egon Durban, Silver Lake Co-CEO and Managing Partner, said that Jio Platforms is one of the world’s “most remarkable” companies. “They have brought extraordinary engineering capabilities to bear on bringing the power of low-cost digital services to a mass consumer and small businesses population.”",https://timesofindia.indiatimes.com/business/india-business/after-facebook-deal-mukesh-ambanis-jio-platforms-bags-rs-5656-cr-investment-from-us-pe-firm-silver-lake/articleshow/75526469.cms,0
05-05-2020,1329.165527,1352.298096,1323.22229,1335.52002,1316.525146,22451881.0,RI,2020-05-05T02:35:00+05:30,Reeba Zachariah,"After FB, US firm to pay $750m for 1.2% stake in Jio","India Business News: After Facebook, US-based private equity firm Silver Lake will pay Rs 5,656 cr ($750 million) to acquire 1.15% in digital & telecom unit of Reliance In","MUMBAI: After Facebook, US-based private equity firm Silver Lake will pay Rs 5,656 crore ($750 million) to acquire 1.15% in the digital and telecom unit of Reliance Industries (RIL). The Jio Platforms deal, Silver Lake’s biggest investment in India, will help RIL accelerate its debt-reduction plans. The transaction values Jio Platforms at Rs 5.15 lakh crore ($69 billion)—a 12% premium in rupee terms to the enterprise valuation implied by Facebook’s investment in the Indian company. On April 22, Facebook said it will spend Rs 43,574 crore ($5.7 billion) for a 9.99% stake in Jio Platforms, which owns India’s largest wireless operator. Both the deals, coming amid the pandemic-induced lockdown, are subject to regulatory approvals. In 2013, Silver Lake made its first investment in India through Bengaluru-based Eka Software Solutions. The fund’s investment in Jio Platforms establishes a new pricing benchmark for the Indian company that will see more external investors in the coming months. In its quarterly earnings commentary on April 30, RIL said that it has received interest from multiple global investors to buy additional stakes in Jio Platforms and that it would announce investments similar to the Facebook transaction. In that context, though the Silver Lake investment is positive, the size is very small compared to the Facebook deal and hence investors would like to see more marquee transactions in Jio Platforms, wrote analysts at JP Morgan in their research report. While RIL has not specified the total quantum of stake it intends to sell in Jio Platforms to outside parties, the share sales form part of chairman Mukesh Ambani’s broader plan to take the unit public in the future. Last October, RIL placed the entire digital and telecom assets in its 100% arm Jio Platforms in order to bring in external investors. Foreign investors now have a holding of 11.14% in Jio Platforms, a startup launched in late 2016 and that has become a force to reckon within the telecommunications industry with 388 million subscribers. The digital services business earned an operating profit of Rs 14,363 crore on an annual revenue of Rs 68,462 crore—up 64% and 41% from fiscal 2019. RIL has launched an aggressive programme to augment its balance sheet, which includes stake sales in its subsidiaries, rights offering and slowing down on fresh investments. The nation’s most valued enterprise, which is shifting its positioning from an energy-driven player to a consumer/technology-focused company, has a debt of Rs 3.36 lakh crore as on March 31, 2020. Ambani had said that he plans to make RIL a net debt-free company by the end of this financial year. Founded in 1999, Silver Lake, which manages assets worth $40 billion, places its bet mainly on technology and tech-enabled opportunities. The fund has investments in Dell Technologies, Twitter, Airbnb and Alibaba, to name a few. Its portfolio of investments collectively generates an annual revenue of over $230 billion and employs 3.7 lakh people worldwide. “Silver Lake has an outstanding record of being a valuable partner for leading technology companies globally. We are excited to leverage insights from their global technology relationships for the Indian digital society’s transformation,” said RIL chairman Ambani. Jio Platforms is Silver Lake’s third deal in the past one month after online travel booking firm Expedia and home-renting company Airbnb. “Jio Platform’s incredibly strong and entrepreneurial management team have brought extraordinary engineering capabilities to bear on bringing the power of low-cost digital services to a mass consumer and small businesses population. The market potential they are addressing is enormous, and we are honoured and pleased to have been invited to partner with Mukesh Ambani and the team at Reliance and Jio,” said Silver Lake Co-CEO Egon Durban.",https://timesofindia.indiatimes.com/business/india-business/after-fb-us-firm-to-pay-750m-for-1-2-stake-in-jio/articleshow/75544478.cms,0
06-05-2020,1338.58313,1357.738403,1321.667969,1335.611572,1316.615356,20244547.0,RI,2020-05-06T04:40:00+05:30,"Madhav Chanchani,Digbijay Mishra",Reliance Industries plans to buy e-pharmacy Netmeds,India Business News: Mukesh Ambani’s Reliance Industries is in advanced discussions to acquire a majority stake in online pharmacy Netmeds as part of its broader play in c,"BENGALURU: Mukesh Ambani’s Reliance Industries is in advanced discussions to acquire a majority stake in online pharmacy Netmeds as part of its broader play in commerce, said three sources familiar with the development. The deal may see Reliance, through one of its subsidiaries, pay $130-150 million for the asset, which may also include a fresh infusion to expand the operations, said one of the sources mentioned earlier. “The deal is happening at a slight premium to their last funding round valuation,” said the source. Netmeds, which started operations in 2015, has till date announced three rounds of funding totalling about $100 million. The company was started by Pradeep Dadha, whose family was one of the first distributors for Sun Pharmaceuticals. The distribution business was later acquired by Sun Pharma. Besides Dadha’s family office, the Netmeds backers include healthcare investor OrbiMed, investment bank MAPE Advisory, Sistema Asia Fund and Singapore-based Daun Penh Cambodia Group. “As a policy, we do not comment on media speculation and rumours. Our company evaluates various opportunities on an ongoing basis,” said a Reliance spokesperson, adding that it will inform exchanges according to Sebi on any developments.  75564361“It would not be productive to comment on media speculations at this stage,” said Dadha in an emailed response, while adding that Netmeds has tied up with Reliance Retail for supplying essentials like groceries to its customers.The conversations between Reliance and Netmeds, which had also held talks with Walmart-owned Flipkart, had been going on before the coronavirus lockdown, sources said. This will be the second major move by Reliance in the pharma sector as last year it acquired 82% in Bengaluru-based C-Square Info Solutions, which makes software for distributors, retailers and sales force in the pharma sector, for a total of Rs 82 crore. Some of the clients of the company include Apollo Pharmacy, Adcock Ingram and other players. The development comes as Reliance is ramping up it’s online-to-offline (O2O) commerce business, first with grocery with the tie-up between Reliance Retail and WhatsApp last month. That deal came after WhatsApp’s parent company Facebook agreed to invest $5.7 billion for a 9.99% stake in Jio Platforms, the telecom and digital services business of Reliance. Netmeds generates 90% of its revenue from prescription medicine and over-the-counter drugs. This is similar to other medicine delivery platforms like 1MG, Medlife and Pharmeasy who drive 80-90% of their revenue from selling medicine, focused on chronic customers who make repeat purchases regularly. Last year, Netmeds announced it would add a dozen new warehouses to take the total to 26 as it expanded across India. A RedSeer report in February said it has a base of 6 lakh monthly transacting users. According to the RedSeer report, a market research firm, the e-pharma industry, including consultancy and diagnostics, is about $1.2 billion. This is expected to reach about $16 billion in five years. While over 4 million households were already opting for buying medicine online, this space has become one of the few beneficiaries of the virus outbreak as more consumers are opting to buy medicine online. By the middle of March, e-pharmacy platforms saw a strong spike in sales of masks and sanitisers. 1MG co-founder and CEO Prashant Tandon had said sales of these products were up by 10-20 times before the virus outbreak. “Order volumes are still higher than before Covid-19. But going forward, we are looking at supply issues and manpower crunch to meet the rising demand,” said CEO of another e-pharma platform. Typically, consumers on average transact 1.5-2 times from these companies, while average ticket size of purchase is Rs 1,400-1,700.",https://timesofindia.indiatimes.com/business/india-business/reliance-plans-to-buy-e-pharmacy-netmeds/articleshow/75564362.cms,2
07-05-2020,1330.354126,1383.979736,1321.210815,1377.853638,1358.256592,25013483.0,RI,2020-05-07T21:23:00+05:30,Reuters,Aarogya Setu app coming to Reliance JioPhone soon,"India will within days roll out a version of its coronavirus contact-tracing application that can run on mobile carrier Reliance Jio's cheap phones, a","NEW DELHI: India will within days roll out a version of its coronavirus contact-tracing application that can run on mobile carrier Reliance Jio's cheap phones, as it looks to increase the reach of the system, a senior government official said.  India, which has imposed the world's biggest shutdown to battle the spread of the coronavirus, last month launched the Aarogya Setu (Health Bridge) app -- a Bluetooth and GPS-based application which alerts users who may have come in contact with people who later test positive for COVID-19. The app, which has been downloaded more than 83 million times so far, was initially available to India's roughly 500 million smartphone users on Google's Android and Apple devices, but not to around 400 million users of more basic feature phones. Within a week, a version of the app will be rolled out to more than 100 million users of the $9 JioPhone - a cheap, internet-enabled feature phone that runs on a mobile operating system named KaiOS, a senior government official told Reuters. Launched by Reliance Industries' telecoms unit in 2017, the phone gives users access to 4G mobile data and apps including Facebook Inc's popular WhatsApp messenger.  ""We are pushing it ... the testing is going on,"" said the official who declined to be identified as the plan is not public. India's technology ministry and Reliance Jio did not immediately respond to emails seeking comment.  Contact tracing apps such as Aarogya Setu are being used in an attempt to speed up the process of identifying, testing and isolating people exposed to the virus before they spread it to others. While many countries around the world are using similar apps, some such as Australia and Colombia are turning to technology from Apple and Alphabet's Google amid citizens' privacy concerns and glitchy state-backed systems. ",https://timesofindia.indiatimes.com/gadgets-news/aarogya-setu-app-coming-to-reliance-jiophone-soon/articleshow/75606847.cms,2
08-05-2020,1412.644043,1444.554199,1405.420776,1428.004883,1407.694458,42131385.0,RI,2020-05-08T08:03:00+05:30,TIMESOFINDIA.COM,"Vista Equity Partners to invest Rs 11,367 crore in Jio platforms","India Business News: Private equity firm Vista Equity Partners will pump Rs 11,367 crore into Jio Platforms for a 2.32 per cent stake. This is the third investment announc","NEW DELHI: Private equity firm Vista Equity Partners will pump Rs 11,367 crore into Jio Platforms for a 2.32 per cent stake. This is the third investment announcement for Mukesh Ambani's company after social media giant Facebook and Silver Lake’s share acquisition proposal in the last few weeks. 75526469“This investment values Jio Platforms at an equity value of Rs 4.91 lakh crore and an enterprise value of Rs 5.16 lakh crore,” Reliance Industries (RIL) said in a statement on Friday. Jio Platforms is a wholly-owned subsidiary of RIL.Commenting on the transaction, Ambani, chairman and managing director, RIL, said, ""I am delighted to welcome Vista, one of the world’s marquee tech investors globally as a valued partner. Like our other partners, Vista also shares with us the same vision of continuing to grow and transform the Indian digital ecosystem for the benefit of all Indians.""Robert F Smith, founder, chairman and CEO of Vista, said, “We believe in the potential of the Digital Society that Jio is building for India. Mukesh’s vision as a global pioneer, alongside Jio’s world-class leadership team, have built a platform to scale and advance the data revolution it started.""The transaction is subject to regulatory and other customary approvals, the RIL statement mentioned.Morgan Stanley acted as financial advisor to RIL and AZB & Partners and Davis Polk & Wardwell acted as legal counsels. Kirkland & Ellis LLP and Shardul Amarchand Mangaldas & Co served as legal counsels to Vista.",https://timesofindia.indiatimes.com/business/india-business/vista-equity-partners-to-invest-rs-11367-crore-in-jio-platforms/articleshow/75615166.cms,2
11-05-2020,1444.64563,1476.647339,1437.605347,1441.719849,1421.2146,33542531.0,RI,2020-05-11T21:52:00+05:30,Reuters,State refiners scale up crude processing as fuel demand improves,India Business News: Indian refiners are scaling up crude processing as local fuel demand begins to improve with a gradual easing of the lockdown aimed at stemming the spr,"NEW DELHI: Indian refiners are scaling up crude processing as local fuel demand begins to improve with a gradual easing of the lockdown aimed at stemming the spread of coronavirus, company officials said.Indian Oil Corp, the country’s top refiner, has raised crude processing at its plants to 60% capacity and aims to reach 80% by the end of this month, it said in a statement on Monday.State refiners, which together own about 60 per cent of India’s 5 million barrel per day (bpd) refining capacity, had to reduce the amount of crude they process as storage facilities filled up with unsold products due to a slump in demand.“With the demand for petroleum products gradually picking up, Indian Oil Corp has re-started several process units at its refineries that were down due to the lockdown,” IOC said.IOC curtailed its crude processing to an average 45% by the first week of April as the nation wide lockdown from March 25 had curbed mobility and grounded economic activity to a halt.The lockdown is set to last until at least May 17.India’s fuel demand dipped about 46% in April from a year earlier, its lowest since 2007.Oil minister Dharemendra Pradhan last week said India’s fuel demand growth could return to normal by mid-May.IOC has re-started several units at its refineries and resumed operations at its Panipat naphtha cracker in northern India, expecting an improvement in petrochemical demand in the coming days.State refiners IOC, Hindustan Petroleum Corp and Bharat Petroleum Corp operate about 90% percent of retail fuel pumps in India.These companies also buy products from standalone refiners like Mangalore Refinery Petrochemical Crop and private companies Reliance Industries Ltd and Nayara Energy to meet local demand.MRPL’s Southern India-based refinery is operating at about 50% capacity, an improvement from about 42% seen in April, a company official said.“Further improvement in our crude processing depend on purchases by fuel retailers as exports market is also not attractive,” said the official, who did not wish to be identified.India’s second biggest state-refiner BPCL is operating its Mumbai refinery at about 70% capacity compared to 50% in April, its head of refineries R Ramachandran said. The company’s crude runs at its four refineries average about 52% as some of its refiners are still operating at lower rates, he said.“We are seeing that our product inventory is gradually reducing which is a good sign,” he said.",https://timesofindia.indiatimes.com/business/india-business/state-refiners-scale-up-crude-processing-as-fuel-demand-improves/articleshow/75681458.cms,1
